"포인트 랭킹에 한국선수가 보인다.,아시아리그 아이스하키 개인기록에 대명 상무 돌풍이 불고 있다. 상무는 21일 현재 포인트 부문에서 무려 4명의 선수가 이름을 올리면서 돌풍이 예사롭지 않음을 보여주고 있다. 조민호는 20일 닛코 아이스벅스와의 경기에서 혼자 어시스트 3개를 추가함으로써 포인트 랭킹 3위 24포인트 6골 18어시스트 로 올라섰다. 박우상은 23포인트 10골 13어시스트 로 4위 김원중이 18포인트 9골 9어시스트 로 공동 8위 그리고 수비수 이돈구는 16포인트 3골 13어시스트 를 기록했다. 또하나 주목할 점은 이돈구다. 그는 수비수로서는 8개 구단 중 유일하게 랭킹에 올라 있다. 최근 2년 간 아시아리그 개인 기록에 이름을 올린 선수는 강원 하이원 송동환이 유일했다. 송동환은 지난해 4위 74포인트 2011시즌에는 닛코 아이스벅스에서 뛰며 9위 45포인트 에 올라 코리언 로케트 라는 별명을 입증했다. 허리부상으로 컨디션이 썩 좋지 않은 송동환은 올시즌에도 16포인트로 공동 10위를 달리고 있다. 김세일 전 안양 한라 감독은 그동안 파워플레이 때 외국인선수가 주축을 이뤄 한국 선수들이 포인트를 쌓는데 불리했다. 상무는 외국인 선수가 없기 때문에 자연스럽게 포인트가 많아지고 있는 것 이라고 했다. 아이스하키는 득점과 어시스트를 모두 포인트로 인정한다. 그래서 공격라인이 호흡을 잘 맞추면 자연스럽게 포인트도 많아지게 된다. 감독이 파워플레이 때 누구를 많이 기용하느냐에 따라 포인트가 높아질 수 있다. 그동안 포인트 경쟁에서 아시아 선수들은 크게 이름을 날리지 못했다. 한국 일본 중국을 가리지 않고 포인트 랭킹 10위까지에는 대부분 용병들이 자리를 차지했기 때문이다. 상무는 용병이 없어서 우리선수들끼리 파워플레이를 할 수 밖에 없다. 이런 현실 속에서 이처럼 많은 포인트를 올리고 있는 선수를 배출하고 있다는 것은 우리 선수들의 실력이 출중하다는 증거다. 물론 팀훈련을 통해 기량이 우수한 선수가 파워플레이 라인에 들어가기 마련이지만 상무가 보여주듯 한국 선수들의 기량은 이미 용병 선수와 어깨를 나란히 할 수 있다는 것을 입증해 주는 현상이다.,https://sports.news.naver.com/news.nhn?oid=445&aid=0000000001,2013.10.21"
"후쿠후지의 시대가 저무는가,후쿠후지 유타가 31 . 닛코 아이스벅스의 수문장인 그는 아시아가 배출한 스타다. 그는 고쿠도에서 활약하던 2004년 NHL 드래프트 8라운드 전체 238번 순위로 당시 LA킹스에 드래프트됐던 유망주였다. 1m85의 좋은 체격을 지닌 후쿠후지는 이후 ECHL에서 기량을 쌓은 뒤 2006년에는 LA킹스에서 5게임을 뛰면서 아시아선수로서는 최초로 NHL 얼음판을 밟았다. 후쿠후지는 NHL의 높은 벽을 실감했지만 국제경기 때마다 늘 일본대표팀의 수문장을 맡으면서 한수 위의 기량을 뽐냈다. 북미 마이너리그팀을 전전하던 그는 2010년시즌부터 닛코로 옮겼고 지난 4년간 변함없는 철벽 수비를 과시했다. 방어율이 늘 92 94%대를 기록 그의 컨디션이 좋은 날에는 오지 제지나 일본제지도 닛코의 골문을 열어제치지 못했다. 올시즌이 개막한 뒤 후쿠후지의 글러브가 예전만 못한 것으로 드러나고 있다. 그는 오지제지와의 개막 3연전 중 2차전 때 무려 8골을 내주는 등 과거에는 볼 수 없던 실점을 하고 있다. 올시즌 10경기에서 무려 33골을 허용하며 89%의 방어율을 기록하면서 이 부문 11위에 그치고 있다. 박병철 하이원 매니저는 닛코의 수비가 예년만 못하다. 특히 올래 새로 영입한 맷 웨델이 위력적이지 못하다. 더구나 오노 다카유키가 발 부상으로 뛰지 못해 수비력이 약해진 점이 후쿠후지를 괴롭히고 있다 고 했다. 후쿠후지의 인기는 일본에서 그 누구도 따라오기 힘들 정도다. 목동링크에도 그의 44번 유니폼이 여러개가 걸려 있을 정도로 많은 팬들이 서울까지 응원을 왔다. 그러나 상무가 두차례의 경기에서 6점을 뽑아낼 정도로 후쿠후지의 방어막은 약화돼 있다.,https://sports.news.naver.com/news.nhn?oid=445&aid=0000000002,2013.10.21"
"안양 한라 아쉽다 완봉승. 닛코에 41승.,안양한라 손호성이 아이스벅스 데이비드 봉크의 슛을 막아내고 있다. 사진 임채우 기자 ufeff 경기 종료 8초 전. 닛코 아이스벅스 우에노의 골이 터지자 안양 한라 골리 손호성의 아 하는 안타까운 외침이 링크에 울려 퍼졌다. 경기가 끝난 뒤 한라 선수들은 손호성에게 다가가 완봉승을 놓친 선배를 위로했다. 내일은 꼭 완봉승을 하자는 다짐을 하면서. 한라가 22일 안양아이스링크에서 벌어진 닛코 아이스벅스와의 2013 14 아시아리그 아이스하키 시즌 첫 경기에서 4대1으로 승리했다. 마이클 테스트위드 2골 가 리그 데뷔 첫 멀티골을 기록했고 부상에서 돌아온 이영준 1골2어시스트 과 골리 손호성이 맹활약했다. 한라는 2연승의 휘파람을 불었고 닛코는 방한 1승 2패를 기록했다. 지난주 일본 원정에서 저조한 성적 1승 3패 으로 돌아온 한라는 홈에서는 지지 않겠다는 각오로 경기에 나섰다. 1피리어드 초반 아이스벅스는 상무와의 경기때처럼 느슨한 모습을 보이며 한라에게 2배나 많은 슛팅 22 11 을 얻어 맞았다. 하지만 스타 골리 후쿠후지의 선방으로 한라는 경기가 풀리지 않았다. 두드리면 열린다고 했던가 한라는 16분 43초 디펜스 김우영이 블루라인에서 때린 슬랩샷이 골 크리스 앞에 있던 테스트위드의 스케이트를 맞으면서 득점에 성공했다. 기세가 오른 한라는 1피리어드가 종료될 때까지 끊임없이 공격했지만 추가 득점없이 2피리어드를 준비했다. 아이스벅스는 2피어리드 중반까지 수비에 치중하며 기회를 노렸지만 되려 8분 3초 이민우의 터닝슛이 테스트위드를 맞고 골리 다리 사이로 빠져들어가면서 실점을 허용했다. 3피리어드에 살아난 아이스벅스는 보다 많은 슛팅 10 17 으로 한라 디펜스를 괴롭혔지만 득점에 성공하지 못했다. 슛이 굴절돼 행운의 2득점에 성공한 한라는 15분 22초 수비수 조형곤 1골 이 쏜 슛이 또 다시 골리 후쿠후지의 글러브를 맞고 들어가는 골이 돼 3대0으로 앞서가기 시작했다. 추격의 의지가 꺽인 아이스벅스는 2분 30초 뒤에 이영준에게 4번째골을 내주며 경기를 끝내려는 듯 보였다. 하지만 영패만은 모면하겠다는 아이스벅스는 긴장감이 풀린 한라의 틈새를 놓치지 않고 경기 종료 부저가 울리기 8초를 남기고 득점에 성공했으나 역부족이었다. 아이스벅스는 수비수 오노의 부상 결장에 2라인 공격수 이이무라 요시노리가 경기 도중 부상으로 빠지면서 공격에 힘을 잃었다. 한편 하치노헤에서 있었던 도호쿠 프리블레이즈와 오지 이글스와의 경기는 6대1로 이글스가 승리하며 스윕에 성공했다. 한라는 23일 안양아이스링크장에서 닛코 아이스벅스와 시즌 2차전을 갖는다.,https://sports.news.naver.com/news.nhn?oid=445&aid=0000000003,2013.10.22"
"안양 한라 손호성 드디어 완봉승.,안양한라 손호성이 아이스벅스 이와모토 카즈마의 슛을 막아냈다. 임채우 기자 ufeff 안양 한라가 마침내 닛코 아이스벅스를 셧아웃시켰다. 전날 8초를 남기고 한골을 내줘 시즌 첫 완봉승에 실패했던 한라는 이날 확 달라진 모습이었다. 상대의 슛은 스틱으로 쳐냈고 스틱이 못미치면 슬라이딩으로 막아내는 투지가 보였다. 31세 노장 골리 손호성은 후배들의 투혼에 기어이 완봉승으로 화답했다. 한라는 23일 안양링크에서 벌어진 2013 2014 아시아리그 아이스하키 홈경기에서 골리 손호성의 철벽 방어를 앞세워 아이스벅스를 4대0으로 완파했다. 손호성은 32개의 슛을 완벽하게 막아내 시즌 첫번째 셧아웃의 감격을 누렸고 한라는 3연승을 질주했다. 한라는 승점 23점을 기록하며 강원 하이원 승점 20점 을 제치고 4위로 도약했다. 난전이었다. 그러나 힘과 체력에서 한라가 한수위였다. 양팀선수들이 골대에서 몸싸움을 하고있다. 임채우 기자 ufeff 한라는 1피리어드에는 4조를 넉넉하게 돌리며 3조로 맞선 아이스벅스와 0 0으로 팽팽한 균형을 이뤘다. 2피리어드에 들면서 양팀의 차이는 서서히 드러났다. 한라는 4분쯤 5 3 파워플레이에서 우드의 패스를 받은 디멘의 슬랩샷을 골대 앞에서 스크린플레이를 펼치던 성우제가 방향을 살짝 바꿔 네트에 꽂아 넣으면서 1 0으로 앞섰다. 한라는 14분에도 문국환 디멘의 패스를 받은 수비수 윤경원의 총알같은 슬랩샷이 또 한번 아이스벅스 그물망을 갈라 2 0으로 승기를 잡았다. 안양한라 블락 라던스키 3번재 골 득점후 동료들과 즐거워하고 있다. 임채우 기자 한라는 3피리어드에는 체력이 고갈된 아이스벅스를 일방적으로 몰아부치다 라던스키가 5분쯤 추가골을 뽑아 3 0으로 앞서면서 사실승 승부의 쐐기를 박았다. 아이스벅스는 영패를 면하기 위해 3분을 남기고 골리를 빼는 등 안간힘을 썼으나 오히려 1분여를 남기고 문국환에게 텅빈 골대에 추가골을 내주며 무너졌다. 아이스벅스는 종료 직전 이와모토가 스틱으로 라인맨을 고의로 가격해 퇴장당하는 등 매너에서도 완패했다.,https://sports.news.naver.com/news.nhn?oid=445&aid=0000000004,2013.10.23"
"하이원에게는 기회 닛코에는 위기,아이스벅스 이와모토 카즈마 심판 판정에 불만을 품고 선심에게 주먹을 날린 닛코 아이스벅스 이와모토 카즈마 25 에게 10게임 출전 정지 징계가 내려졌다. 아시아리그 사무국은 24일 안양 한라와의 경기 23일 안양 에서 선심을 주먹으로 때린 이와모토에게 이같은 징계를 확정 발표했다. 아시아리그는 추후 징계위원회를 소집해 이와모토에 대한 추가 징계를 결정할 예정이다. 대한아이스하키협회 이병철 심판이사는 아시아리그에서 심판을 때린 경우는 이번이 처음 이라면서 심판을 스틱으로 슬쩍 밀치는 일은 있었다. 그 때에도 징계 수위는 아주 높았기 때문에 장기간 출전정지 징계가 예상된다 고 했다. 아이스벅스는 지난해에도 우에노 히로키가 차이나 드래건스와의 경기 도중 몸을 돌리는 척 하면서 스틱으로 심판을 가격해 10게임 출전정지 징계를 받았다. 아이스벅스는 이와모토의 징계로 미니팀이 됐다. 도쿄 인근 닛코의 시민구단인 아이스벅스는 재정난으로 다른 일본팀에 비해 선수의 수가 적다. 더구나 최근 수비수 오노 다카유키가 팔을 다쳐 결장중인데다 공격수 이이무라 요시노리는 한라와의 경기에서 손가락 골절로 당분간 뛰지 못한다. 따라서 아이스벅스는 26일과 27일로 예정된 강원 하이원과의 춘천 경기에 3라인을 제대로 가동할 수 없을 전망이다. 박병철 하이원 매니저는 아이스벅스는 잇따른 선수 부상 등 악재가 겹친데다 한국에서 6게임을 뛰어야 하기 때문에 체력적으로 힘든 상태 라고 했다.,https://sports.news.naver.com/news.nhn?oid=445&aid=0000000005,2013.10.25"
"푸른 눈의 지도자 투오미 인터뷰,티모 투오미 53 전 핀란드 주니어대표팀 감독 진짜 하키를 하려면 계속 스케이트를 타라. 슈팅 타이밍에서 머뭇거리지 말고 쏴라. 상대가 퍽을 빼앗아 공격에 나설 때 뒤돌아 서지 마라 2018 평창 꿈나무 훈련을 위해 한국에 온 티모 투오미 53 전 핀란드 주니어대표팀 감독이 우리 선수들에게 끊임없이 던지는 주문이다. 투오미감독은 대한아이스하키협회가 한국 남자 18세 대표팀 선수 선발과 합숙훈련을 위해 초청했다. 협회가 투오미감독을 초청한 이유는 지난해부터 대학입시제도가 바뀌고 U 18 선수선발에 학무모의 관심이 높아지면서다. 선수선발에 대해 객관적인 평가가 필요하다는 요구와 평창올림픽에 대비해 젊은 선수들을 육성하자는 취지에 초청이 결정됐다. 그는 지난 17일부터 24일까지 태릉빙상장에서 U 18대표 후보선수들을 지도했다. 하키뉴스는 24일 마지막 연습게임을 마친 뒤 투오미 감독과 만나 그동안의 훈련에 대해 인터뷰를 했다. 지난 17일부터 학생들을 지도해 왔고 선발을 앞두고 있다. 소감은 선수들이 매일 달라지고 있다. 연습게임 첫날인 22일에는 선수들이 게임을 하는 것 같지 않았다. 오늘은 몸싸움도 잘하고 슈팅도 잘 쐈다. 만족한다. 서류를 뒤적이며 누구를 선발할 것인지 오늘 당신에게 알려주지는 않겠다. 웃음 당신이 처음 선수들을 만났을 때 어떤 느낌을 받았나. 처음 그들을 봤을 때 게으르고 열심히 하지 않는다는 느낌이었다. 퍽을 기다리고 슛도 쏴야 할 시점에 쏘지 않고 머뭇거렸다. 그렇다면 무엇이 문제였나 몇가지 문제점을 발견했다. 공격을 하다 퍽을 빼앗겨 수비로 전환을 할 때 상대를 압박하기 위해 앞으로 나가야 하는데 등을 돌리고 돌아서는 선수도 있었다. 하키는 접촉이 허용된 게임이다. 그런데 몸을 부딛치려 하지 않았다. 알고 보니 오랫동안 하키가 아닌 하키를 하고 있었다. 그래서 바뀌어야 한다고 강조했고 선수들이 많이 변했다. 한국선수들이 고쳐야 할 것이 있다면 구체적으로 무엇인가 첫째는 슛을 쏴야 할 타이밍에 머뭇거린다. 스코어링 포지션에 있을 때는 과감하게 슛을 쏴야 한다. 둘째 하키는 공격진영 중립진영 수비진영으로 나뉜다. 퍽을 갖기 위해 더 빨리 움직여야 하는데 많은 선수들이 습관적으로 퍽이 자신에게 오기 전까지 그냥 서 있다. 퍽을 향해 계속 움직여야 한다. 셋째 갭 콘트롤을 잘 하지 못한다. 즉 수비를 할 때 상대가 퍽을 컨트롤하지 못하게 해야 한다. 심지어는 상대를 멈추도록 압박을 해야 한다. 루즈 퍽 상황이 됐을 때도 적극적으로 다가가야 하는데 주저하는 선수가 많다. 한국선수들의 장점은 무엇인가. 그리고 눈에 띄는 선수가 있나 스키이팅이 아주 좋다. 사흘 연속 연습경기를 했는데도 지치지 않는 것을 보면 지구력도 좋아보인다. 몸싸움을 많이 하고 스케이트를 멈추지 않고 슈팅을 과감하게 하면 된다. 오늘 24일 게임은 정말 만족스럽다. 2 3명의 선수들은 리더 역할을 한다. U 18 대표선수는 28일부터 다음달 8일까지 투오미 감독의 지휘 하에 고려대 아이스링크에서 합숙훈련을 할 예정이다. 투오미감독은 1985년부터 핀란드 주니어팀 감독을 맡아 지도자의 길로 들어선 뒤 2000년 스위스 주니어세계선수권대회에서 핀란드를 우승시킨 명장이다. 그는 2002년부터 일본 대표팀감독을 지내면서 2003 아오모리 동계 아시안게임 금메달 2010년부터 2012년까지는 스페인 남자대표팀에서 코치와 인스트럭터를 지냈다. 지난 7월에는 안양 한라의 인스터럭터를 맡아 젊은 한라를 수비력 있는 팀으로 바꿔놓았다.,https://sports.news.naver.com/news.nhn?oid=445&aid=0000000006,2013.10.25"
"U18 대표선수 확정,대한아이스하키협회는 송형철 경성고 등 내년 세계선수권대회에 출전할 아이스하키 U 18 대표팀 명단을 25일 발표했다. 공격수로는 이민석 신송고 3학년 등 12명 수비수는 송형철 등 8명 그리고 양희태 보성고 등 골리 3명 총 23명이 뽑혔다. 이번 선발은 핀랜드 청소년대표팀감독을 지낸 티모 투오미 감독이 직접 선수 개개인의 기량과 특성 경쟁력을 파악해 결정했다. 협회 양승준 전무이사는 사상 처음 탑 디비전에서 우승을 경험했던 지도자가 선입견 없고 이해관계 없는 상황에서 선발했다 면서 투오미감독은 짧은 기간이었지만 모든 선수 개개인의 능력을 정확하게 파악해 선발 이유를 설명했다. 매우 만족한 결과를 얻었다 라고 했다. 대표선수들의 합숙훈련은 28일부터 11월8일까지 고려대 링크에서 투오미감독의 지휘 하에 실시된다.,https://sports.news.naver.com/news.nhn?oid=445&aid=0000000007,2013.10.25"
"점점 위력 떨치는 하이원 3인방,하이원 송동환 마이클스위프트 콘 요스케 강원 하이원 1라인 공격수인 송동환 33 한국 마이클 스위프트 27 캐나다 콘 요스케 35 일본 . 국적은 각각 다르지만 이들 세 명이 만나면 가공할 위력을 발휘하는 공격진이 펼쳐진다. 하이원이 3국 트리오 의 활약을 앞세워 니코 아이스벅스에 힘겨운 승리를 거뒀다. 하이원은 26일 춘천으로 장소를 옮겨 벌어진 2013 2014 아시아리그 아이스하키 정규리그 경기에서 혼자 3포인트 2골 1어시스트 를 기록한 스위프트와 송동환 1골 1어시스트 콘 요스케 1골 1어시스트 의 활약을 발판삼아 4대3으로 이겼다. 하이원 콘 요스케 스코어는 3 3. 남은 시간은 6분여. 연장전의 분위기가 짙어지던 상황에서 하이원은 상대편의 반칙으로 파워플레이의 호기를 맞이했다. 결과는 여지 없었다. 송동환은 스위프트의 패스를 받아 골대 뒤에서 퍽을 밀어준 콘 요스케의 절묘한 패스를 스냅샷으로 그물을 갈라 대미를 장식했다. 이날 하이원이 기록한 4골이 모두 1조가 만들어 낸 골이었다. 이 승리로 하이원은 8승3패를 기록 승점 23점을 따내며 안양 한라와 다시 공동 4위로 도약했다. 반면 선수 부상과 잇따른 선수 퇴장으로 인해 팀웍이 깨진 아이스벅스는 3연패의 늪에 빠졌다. 닛코는 이날도 1피리어드 도중 외국인 수비수 맷 웨델이 심판에 욕설을 퍼붓다 퇴장당해 심판 구타 사건 이후 2게임 연속 퇴장선수가 발생 팀웍이 무너지며 무릎을 꿇었다. 선취점은 아이스벅스의 차지였다. 아이스벅스는 1피리어드 12분쯤 우에도 콘노의 패스를 받은 외국인 공격수 데이비드 봉크의 슛이 터져 1 0으로 앞서나갔다. 반격에 나선 하이원은 2분 후 스위프트가 블루라인 안쪽으로 뛰어들어 만든 단독 찬스에서 기습적인 강슛을 날려 1 1 동점을 만들었다. 게임의 주도권을 잡은 하이원은 다시 2분 후 파워플레이 때 스위프트 송동환의 패스를 콘 요스케가 우측 골대 앞에서 가볍게 밀어 넣어 역전골을 뽑아냈다. 하이원은 1피리어드 19분에는 또 한번의 파워플레이에서 스위프트가 추가골을 뽑아내 3 1로 리드했다. 저력있는 아이스벅스는 2피리어드 5분쯤 사이토 켄타의 골로 한점차로 추격한 뒤 3피리어드 12분에는 파워플레이에서 스즈키 유타의 골로 기어이 3 3 동점을 이뤘지만 역부족이었다.,https://sports.news.naver.com/news.nhn?oid=445&aid=0000000008,2013.10.26"
"대명 상무 크레인스 연파.,대명상무 조민호 대명 상무가 파죽지세다. 원정 2게임을 모두 쓸어 담았다. 일본 쿠시로에 원정중인 상무는 27일 벌어진 크레인스와의 경기에서 조민호가 경기 종료 7분을 남기고 2골을 터뜨린데 힘입어 4대3으로 역전승했다. 파죽지세의 상무는 전날에 이어 2위 크레인스를 연파하고 승점 36점을 획득 2위로 올라섰다. 크레인스는 승점 35점에 머물러 3위가 됐다. 상무는 크레인스 콤비 라자 밀러의 공격을 막지 못해 3피리어드 7분을 남길 때까지 2 3으로 끌려갔다. 그러나 상무는 6분을 남기고 김원중 신상우의 패스를 조민호가 동점골로 연결하며 뒤집기에 시동을 걸었다. 상무는 이어 종료 2분여를 남기고 또 한차례 김원중 신상우의 패스를 조민호가 때려 넣어 극적인 승리를 기록했다. 조민호는 혼자 4포인트 2골 2어시스트 를 김원중은 3포인트 1골 2어시스트 를 올려 승리의 수훈갑이 됐다. 상무는 슈팅수에서 22 40으로 열세였지만 정신력으로 승리를 거머쥐었다. 한편 춘천 의암링크에서 벌어진 경기에서는 강원 하이원이 닛코 아이스벅스와 슛아웃까지 가는 접전을 펼쳤으나 1 2로 패배했다. 하이원은 1피리어드를 0 0으로 마친 뒤 2피리어드 6분쯤 아이스벅스 사이토에게 선취골을 내줘 0 1로 끌려갔다. 하이원은 3피리어드 11분쯤 수비수 브라이언 영이 김동환 마이클 스위프트로 연결된 퍽을 아이스벅스 골리 후쿠후지의 가랑이 사이로 밀어 넣어 1 1 동점을 이뤘다. 양팀은 5분 연장전에서도 득점하지 못해 슛아웃에 들어섰고 아이스벅스는 첫번째 슈터 데이비드 봉크와 두번째 슈터 우에노가 골을 성공시킨 반면 하이원은 스위프트만 득점해 분패했다. 아이스벅스는 이날 14명이 뛰는 가운데 귀중한 1승 승점 2점 을 올렸다.,https://sports.news.naver.com/news.nhn?oid=445&aid=0000000009,2013.10.27"
"조민호 포인트 랭킹 2위로 급부상,대명상무 조민호 스틱에 불났다 . 대명 상무 조민호 26 의 별명이다. 스틱 핸들링이 워낙 현란하다보니 동료들이 붙여준 이름이다. 스틱에 불이 난 조민호의 기량이 만개하고 있다. 조민호는 27일 쿠시로에서 벌어진 일본제지 크레인스와의 경기에서 혼자 4포인트 2골 2어시스트 를 기록하며 팀의 승리 4 3 를 이끌었다. 이로써 조민호는 올시즌 19경기에서 31포인트를 기록하고 크레인스의 아담 밀러 33포인트 에 이어 이 부문 2위로 올라섰다. 2003년 출범한 아시아리그에서 한국 선수가 포인트랭킹 상위권에 오른 것은 2006 2007시즌 당시 강원랜드 현 하이원 에서 활약하던 김규헌이 3위를 차지한 것이 최고였다. 김규헌은 64포인트를 기록했으며 당시에는 팀당 34게임을 치렀다. 교포선수인 알렉스 김이 2007년과 2009년 포인트 랭킹 1위를 기록한 적이 있었으나 그는 외국인 선수 신분이었다. 조민호는 시즌 초반 출발은 미미했다. 허리통증 때문에 고생을 했고 지난달 29일 열린 일본제지 크레인스와의 경기는 뛰지 못했다. 10월 2일 오지제지 이글스와의 경기에 투입됐지만 힘을 발휘하지 못해 상무는 0 4로 완패했다. 그러나 최근 허리통증이 사라지며 조민호는 훨훨 날고 있다. 부상으로 뛰지 못하던 서신일이 20일부터 출전하기 시작하며 출전 시간의 부담이 줄어든 것도 힘이 된다. 김세일 전 한라 단장은 조민호를 보면 러시아 선수들의 스케이팅을 보는 것 같다 면서 특히 자세와 밸런스가 좋아 상대가 밀어도 중심이 흔들리지 않는다. 패스를 좀 더 빨리 한다면 나무랄 데가 없다 고 했다. 고려대를 졸업한 뒤 2009년 한라에 입단한 조민호는 그해 신인왕에 올랐다. 지난해까지 한라에서 뛰다 올해 상무에 입대했다. 조민호의 맹활약에 힘입어 상무는 36포인트를 기록하며 크레인스 35포인트 를 3위로 밀어내고 2위가 됐다. 상무는 29일 크레인스와 4차전을 가진 뒤 도마코마이로 이동 최강팀 이글스와 맞대결 한다.,https://sports.news.naver.com/news.nhn?oid=445&aid=0000000010,2013.10.28"
