"아이스하키 아시아리그 재가동,내셔널 브레이크로 한 숨을 돌린 아시아리그가 5일 안양 한라 차이나 드래건스의 경기로 다시 시작된다. 종합선수권대회 준결승에서 상무에 패해 주춤한 한라는 드래건스와의 원정 3연전에서 이변이 없는 한 승점 9점을 챙길 것이 확실하다. 그렇게 되면 한라의 승점 4일까지 승점 32점 은 41점까지 상승하게 된다. 다른 팀들은 7일과 8일 격돌한다. 모든 경기가 빅 카드다. 우선 국내에서는 강원 하이원과 대명 상무가 춘천에서 맞붙는다. 경기 수 15게임 가 적어 아시아리그 6위로 내려가 있는 하이원은 종합선수권대회 예선과 결승에서 두차례나 상무에 석패했지만 이번에는 상황이 다르다. 전력상 우세하다는 평가를 받았던 하이원은 종합선수권대회에서 대등한 경기를 펼쳤지만 노련한 상무 공격라인에 말렸다. 이번 2연전은 홈경기장인 춘천의암링크에서 벌어지기 때문에 설욕의 좋은 기회다. 하이원은 토호구 프리블레이즈나 닛코 아이스벅스와의 홈경기에서 첫경기는 쉽게 이겨놓고 다음날 패하는 징크스를 남겼다. 집중력과 체력이 문제였던 점을 감안해야 한다. 3위 상무는 팀을 잘 이끌어 왔던 주장 이유원이 무릎 수술로 시즌을 접었으나 김기성이 돌아오면서 그 공백을 잘 메워주고 있다. 상무로서는 모든 것이 순조롭기 때문에 부상자 없이 분위기를 지속하는 것이 최상이다. 일본에서는 2위 일본제지 크레인스가 1위 오지 제지 이글스를 상대로 다시 한 번 도전한다. 크레인스는 지난달 열린 올시즌 첫 2연전에서 두 게임을 모두 내줬다. 1차전은 3 1로 앞서가다가 3피리어드 종료 6분을 남기고 홈팀 이글스에 3점을 잇따라 내주면서 완패했다. 그 후유증인지 크레인스는 2차전에서 1대9라는 믿기지 않는 점수차로 대패했다. 크레인스는 이번 연전을 홈에서 치르기 때문에 역시 설욕을 노린다. 일본팀들은 아직까지 이글스에 1승도 거두지 못했다. 사실상 4강 플레이오프 진출이 멀어진 닛코 아이스벅스도 프리블레이즈를 홈으로 불러들여 연전을 펼친다. 닛코는 연승을 거두지 못하면 꺼져가던 4강의 불씨가 완전히 꺼지게 된다. 승점 20점으로 간신히 5위로 올라선 프리블레이즈로서는 아이스벅스를 완전 제압해 순위를 끌어올리지 못하면 역시 4강 싸움에서 크게 불리해 진다. 날씨는 점점 추위지지만 아시아리그는 경쟁이 가열되고 있다. 특히 상무 한라 하이원 프리블레이즈의 4강 싸움은 한치 앞을 내다볼 수 없다. 부상자가 발생하거나 어떤 이유로든 팀워크가 깨지게 되면 치명상을 입게 된다. 하키 팬들에게는 겨울이 춥지 않게 느껴진다.,https://sports.news.naver.com/news.nhn?oid=445&aid=0000000075,2013.12.05"
"아이스하키 경복이냐 경성이냐,경복의 지키는 하키 냐 경성의 벌떼 하키 냐. 2013년 고교 아이스하키리그 왕중왕전은 경복고와 경성고의 한판 승부로 가려지게 됐다. 올시즌 두 팀은 세 번 맞붙었다. 3번시드인 경성고가 1번시드인 경복고에 오히려 2승1패로 우세를 점하고 있다. 경성고는 1차리그에서 슛아웃까지 가는 접전 끝에 3대2로 승리했고 3차리그에서도 2대1로 이겼다. 경복고는 2차대회에서 3대2로 이겼다. 어느 팀이 우세할까. 춘계연맹전 우승팀 경복고 경복은 전통의 팀이다. 코리언 로켓 송동환 하이원 을 비롯해 김원중 상무 문국환 한라 김혁 하이원 등 많은 졸업생들이 이 학교 출신. 경복은 1학년부터 3학년까지 선수층이 고른 것이 장점이나 연세대 진학이 확정된 3년생 포워드 허진영이 무릎 수술로 뛰지 못하게 된 것아 치명적이다. 신동철과 함께 경복 공격을 이끌던 허진영이 빠지자 경복은 4강전에서 보성고의 끈질긴 수비벽을 허물지 못한 채 3피리어드까지 고전했다. 보성의 페널티로 얻은 3피리어드 공격 찬스에서 신동철의 어시스트를 받은 수비수 박지환의 골이 터져 2대1로 힘겨운 승리를 거뒀다. 경복의 라이벌 경기고 김상준 감독은 선수의 면면을 볼 때 경복고는 중학교 시절부터 이름있는 선수들이 포진해 있다. 그러나 자신들의 실력을 다 발휘하지 못하고 있는 것 같다 고 했다. 1차대회 우승팀 경성고 경성고 역시 80년대 이후 가장 많은 스타를 배출한 학교다. 변선욱 상무감독 윤성엽 연대감독 김희우 고대감독이 모두 이 학교 출신. 경성은 4강전에서 예상을 깨고 대회 2연패에 도전하던 2번시드 선덕고를 4대0으로 완파했다. 다수의 전문가들은 현재 전력만을 놓고 보면 경성고가 우세해 보인다 고 한다. 경성고는 수비의 쌍두마차라고 할 수 있는 3년생 정종현과 송형철이 동료들을 이끌고 있는 점이 장점이다. 뿐만 아니라 이승준 진채운 최운재 등 기량이 엇비슷한 선수들이 포진해 있어서 라인간 균형이 잘 맞는다. 더구나 마이너페널티를 두려워하지 않고 적극적인 체킹을 하는 등 팀 플레이가 돋보인다 김상준 경기감독은 최근 선수들의 움직임만을 놓고 보면 경성이 우세해 보인다. 경성선수들은 혼자 하려는 선수가 없다. 특히 3학년들이 팀을 이끌어 줘야 하는 상황에서 경성선수들의 응집력이 강해 보인다 고 했다. 단기전에서 가장 위력을 떨치는 수문장의 대결에서는 3학년생인 경복 이연승이 다소 우세해 보인다. 그러나 2년생인 경성 서준영도 최근 U 18대표에 선발되면서 상승세를 타고 있다. 4강전에서 드러난 것처럼 선취골을 얻은 팀이 모두 승리했다. 따라서 왕중왕전의 승패는 먼저 골을 넣은 팀이 우세할 전망이다.,https://sports.news.naver.com/news.nhn?oid=445&aid=0000000076,2013.12.05"
"아이스하키 신상훈 연패 탈출을 이끌었다.,신상훈 20 이 혼자 3포인트 1골 2어시스트 를 올리며 팀의 연패를 끊었다. 핀란드 메스티스 2부 리그 키에코 완타의 에이스로 부상하고 있는 신상훈은 5일 한국시간 핀란드 트리오 아레나에서 열린 삽코와의 홈경기에서 1골 2도움을 기록하며 팀의 4 3 연장승을 이끌었다. 신상훈은 지난달 30일 유쿠리트전 2 3 패 에 이어 2경기 만에 득점포를 재가동했다. 신상훈은 현재 21경기에 출전해 8골 2도움을 기록 중이다. 신상훈은 이날 경기에서 고비 때마다 팀의 득점에 기여했다. 2라인 레프트 윙으로 출전한 신상훈은 0 1로 뒤지던 2피리어드 6분14초에 상대 골리에 맞고 튕겨나온 퍽을 밀어 넣어 동점골을 뽑았다. 이어 2 3으로 뒤지던 3피리어드 종료 2분여를 남기고는 문전으로 달려든 동료 사쿠 살메라의 동점골을 어시스트했다. 신상훈의 팀 기여도는 연장전에서도 빛을 발했다. 연장 피리어드 경기 종료 51초를 남긴 상황에서는 상대의 퍽을 빼앗아 로버트 루바에게 어시스트 결승골을 어시스트했다. 메스티스 홈페이지 www.mestis.fi 에는 신상훈이 키에코 완타의 연패 탈출을 이끌었다 고 소개했다. 한편 핀란드 일간지 헬싱인 사노맛 은 지난 2일 스포츠섹션 한 면 전체를 할애 신상훈의 인터뷰를 게재했다. 이 신문은 꿈이 당신의 심장을 뛰게 한다 는 제목의 기사에서 평창동계올림픽 출전을 꿈꾸는 신상훈과 한국 아이스하키의 도전 등을 상세히 소개했다. 신상훈의 활약에 힘입은 키에코 완타 승점 34점 는 8연패의 사슬을 끊으며 플레이오프 진출의 불씨를 되살렸다.,https://sports.news.naver.com/news.nhn?oid=445&aid=0000000077,2013.12.05"
"아이스하키 안양 한라 김상욱 컴백 차이나 드래건스에 낙승,안양 한라 에이스 김상욱이 돌아왔다. 김상욱은 5일 중국 상하이에서 벌어진 2013 2013 아시아리그 아이스하키 차이나 드래건스와의 원정경기에서 2골3도움을 기록하면서 안양 한라의 8대1 승리를 이끌었다. 이 승리로 한라는 11승12패 승점 35점 를 기록하고 3위 대명 상무 승점 39점 추격에 시동을 걸었다. 한라에 입단한 2010 2011시즌부터 한라의 골잡이로 발돋움한 김상욱은 시즌을 앞두고 무릎부상을 당해 지금까지 재활에 전념해 왔다. 그의 부재는 한라의 공격력 부재에 한몫을 한 것도 사실. 이날 김상욱은 복귀전답지 초반부터 포인트를 올렸다. 1 0으로 앞서던 6분쯤 파워플레이에서 테스트위드의 골을 어시스트 하더니 잇따라 어시스트 2개를 추가하면서 자신의 존재감을 과시했다. 3피리어드 4분께는 6 1로 앞서가는 추가골 종료를 앞두고는 또한골을 보태며 완벽한 부활을 알렸다. 한라는 올시즌 단 1승도 거두지 못한 드래건스를 맞아 몸풀듯 전진호 2골 2어시스트 박상진 2골 이민우 3어시스트 윤지만 성우제 이상 2어시스트 등이 활약했다.,https://sports.news.naver.com/news.nhn?oid=445&aid=0000000078,2013.12.06"
"아이스하키 경복고 3년 만에 왕중왕 복귀,경복고가 3년 만에 왕좌에 다시 올랐다. 경복고는 6일 목동아이스링크에서 막을 내린 2013 고교아이스하키리그 왕중왕전 결승에서 연장까지 가는 접전 끝에 손태광 2골 의 골든골에 힘입어 경성고를 3대2로 제압했다. 이 대회 원년인 2010년 우승팀인 경복은 3년 만에 고교 최강에 복귀하면서 춘계 추계대회에 이어 3관왕에 올랐다. 역시 경복의 수비였다. 고교 최강 라인을 구축하고 있는 경복고는 1피리어드부터 경성고와 고교 최강팀을 가리는 경기답게 일진일퇴의 공방전을 펼쳤다. 몸싸움도 적극적이어서 아이스하키팬들에게는 모처럼 볼거리가 될만한 경기. 1피리어드 5분쯤 경복고는 신동철 배병준의 어시스트를 받은 손태광의 골이 터지면서 앞서 나갔다. 반격에 나선 경성고는 15분쯤 파워플레이에서 이승준의 동점골로 1 1 첫번째 동점을 만들었다. 다시 앞서간 팀은 경복이었다. 경복고는 2피리어드 7분 쯤 파워플레이 때 박준성의 패스를 받은 조지현의 골이 터지면서 2 1로 다시 앞서 나갔다. 하지만 경성은 3피리어드 8분 쯤 또한 번 파워플레이로 동점골을 얻었다. 정종현 이승준으로 연결된 패스를 2년생 최운재가 밀어 넣어 두번째 동점을 이루는데 성공했다. 양팀은 한 골을 더 얻기 위해 필사의 노력을 했지만 승부는 연장전으로 향했다. 경복은 연장에 접어들면서 경성을 일방적으로 몰아 부쳤다. 경성 선수들은 체력이 갑자기 동이나 스케이팅을 제대로 타지 못할 정도였기 때문. 경복은 1분 13초를 남기고 승리의 히어로 손태광이 하프라인에서 경성 패스를 빼앗아 우측을 돌파하다 때린 슛이 경성 골리 서준영의 가랑이 사이로 빠지면서 승부는 끝이 났다. 선덕고와의 4강전에서 빠른 패스와 조직력으로 완승했던 경성은 경복고의 적극적인 보디체킹에 번번이 패스가 끊겼다. 특히 3학년생들이 이날 부진한 것이 패인이었다. 한편 대회 최우수선수 MVP 로는 경복 2년생 신수찬에게 돌아갔다.,https://sports.news.naver.com/news.nhn?oid=445&aid=0000000079,2013.12.06"
"아이스하키하이원 상무에 설욕,강원 하이원이 종합선수권대회에서의 빚을 갚았다. 하이원은 7일 춘천의암빙상장에서 벌어진 2013 아시아리그 아이스하키 대명 상무와의 홈경기에서 3피리어드 17분에 터진 마이클 스위프트의 결승골로 2대1 역전극을 펼쳤다. 하이원은 아시아리그에서 처음 만난 상무를 꺾음으로써 4강 싸움에 본격적으로 뛰어들었다. 선취골을 뽑은 팀이 이긴다. 최근 대회 때마다 선취골을 넣는 팀이 이기는 상황에서 분위기를 먼저 잡은 팀은 하이원. 하이원은 1피리어드를 0 0으로 마친 뒤 2피리어드 9분쯤 고현빈 스위프트의 어시스트를 받은 데이비드 브린의 골이 터지면서 1 0으로 앞서나갔다. 1피리어드에서 파상공세를 취했지만 오히려 선취골을 내준 상무는 3피리어드 7분에 신상우가 동점골을 뽑아냈다. 이돈구 조민호의 패스를 받은 신상우는 침착하게 골리를 제치고 득점에 성공한 것. 이후 양팀은 한점을 먼저 얻기 위해 치열한 몸싸움을 펼쳤다. 페널티를 주고받은 혼전 속에서 하이원은 종료 3분여를 남기고 김형준의 어시스트를 받은 스위프트가 골리를 완벽하게 제치고 상무 골대 천장에 결승포를 꽂아 넣었다. 한편 일본에서 벌어진 경기에서는 1위 오지 이글스가 일본제지 크레인스에 3대2로 역전승했다. 크레인스는 2 0으로 앞서다 세골을 내주며 무너졌다.,https://sports.news.naver.com/news.nhn?oid=445&aid=0000000080,2013.12.07"
"아이스하키상무 화끈한 공격력으로 하이원에 완승,대명 상무의 진화는 어디까지일까 상무가 강원 하이원을 대파하고 전날의 패전을 설욕했다. 상무는 8일 춘천의암빙상장에서 열린 2013 2014 아시아리그 아이스하키 원정경기에서 조민호 1골 3어시스트 신상우 2골 콤비의 활약을 앞세워 하이원을 6대3으로 제압했다. 2피리어드 6분이 지날 즈음 김윤성 하이원감독은 주전골리 이노우에를 벤치로 불러들이고 용현호를 투입했다. 그 때 스코어는 5 1이었다. 감독이 주전골리를 경기 도중에 바꾸는 것은 크게 두가지 상황에서다. 팽팽한 접전에서 주전 골리의 컨디션이 좋지 않았을 때 또는 주전 골리가 점수를 너무 많이 허용했을 경우 자신감을 잃지 않도록 배려 차원에서 해 주는 것이다. 이날 이노우에의 교체는 후자의 경우였다. 전날 상무에 한점차로 패한 상무는 경기 시작하자마자 역습 기회를 잡았고 59초 만에 김원중이 조민호 이돈구로 연결된 패스를 하이원 골대 우측을 파고들며 강한 슛을 때려 넣었다. 반격에 나선 하이원은 매섭게 상무를 몰아댔다. 6분 쯤 최정식이 골대 우측에서 퍽을 잡아 상무 골리 박성제를 제친 뒤 백슛으로 반대쪽 골대로 슬쩍 띄워 넣는 고도의 기술슛으로 1 1 동점을 이뤘다. 상무는 하이원의 거친 공격에도 당황하지 않았다. 오히려 1피리어드 종료 직전 신상우가 김윤환의 패스를 때려 넣으며 2 1로 다시 앞섰다. 하지만 승부는 의외로 2피리어드 5분 사이에 끝이 났다. 상무는 2피리어드 시작하자 마자 하이원을 강하게 압박하더니 1분55초 만에 박우상이 그리고 43초 후에는 파워플레이에서 신상우가 승부의 쐐기를 박는 추가골을 터뜨려 순식간에 4 1로 달아났다. 상무는 5분 쯤 이용준 8분께는 김기성이 추가골을 때려 넣음으로서 일찌감치 먹이 사냥을 마쳤다. 하이원은 뒤늦게 수비수 김혁이 연속 골을 뽑아냈지만 점수차를 좁히는 데 만족해야 했다. 특히 1라인 수비수 김동환이 뇌진탕 증세로 유니폼을 입지 못한 데다 상무의 기습공격에 허를 찔린 것이 패인이었다. 한편 일본제지 크레인스는 홈경기에서 난공불락의 요새 같았던 1위팀 오지 이글스를 4대1로 꺾고 오지를 상대로 첫 승리를 거뒀다. 또 프리블레이즈는 닛코 아이스벅스에 3대1로 승리했다.,https://sports.news.naver.com/news.nhn?oid=445&aid=0000000081,2013.12.08"
"아이스하키 현장 스케치 브라이언 영이 과거 본능을 되찾고 있다.,브라이언 영이 과거 본능 을 되찾고 있다. 플레이가 점점 거칠어지고 있는 것이다. 영은 8일 춘천의암빙상장에서 벌어진 대명 상무와의 경기에서 3피리어드 7분28초에 이용준과 몸싸움을 하다 스틱으로 가격했다는 이유로 링크에서 쫒겨났다. 시즌 처음 받은 게임미스컨덕트 페널티다. 영은 전날 경기에서도 상무 오현호의 얼굴을 팔꿈치로 가격 10분짜리 미스컨덕트 페널티를 받았다. 공식 기록상 20분짜리 게임미스컨덕트 페널티를 받음으로써 영은 올시즌 페널티 시간이 무려 73분으로 늘어나게 됐다. 이는 팀내 1위는 물론 리그 내에서 5위에 해당한다. 8일 게임까지 아시아리그에서 가장 많은 페널티 시간을 받은 선수는 안양 한라의 박태환이다. 박태환은 총 115분의 페널티를 부과받아 아시아리그의 악동 으로 부각되고 있다. 2010 2011시즌부터 하이원에서 뛴 영은 사실 반칙 시간이 많은 선수는 아니었다. 첫해에는 34게임을 뛰어 36분 2011 2012시즌에는 36게임에 64분 42게임을 뛴 지난해에는 52분에 불과했다. 그러나 아직 17게임 밖에 뛰지 않은 상황에서 무려 73분의 반칙시간을 기록하고 있는 영의 변신에는 책임감이 뒤따르고 있다. 하이원 선수들은 마이클 스위프트를 제외하면 플레이 스타일이 아주 얌전하다. 악동 으로 불리면서 상대팀의 거친 플레이에 대항할 선수가 없다보니 게임의 흐름을 바꿔줄 선수가 필요한 팀의 필요에 응하고 있는 것이다. 북미하키리그 NHL 에서도 활약했던 영은 사실 캐나다에서도 몸싸움을 잘하던 선수였다. 그러나 아시아리그에 와서는 몸싸움을 잘 안하는 리그의 문화에 젖어들어 과거와 달리 얌전한 선수가 되었다. 하지만 최근 4강 진출 다툼이 치열해 지면서 팀을 이끄는 과거의 본능이 되살아나고 있다. 한국 국적 취득을 눈앞에 두고 있는 영이 대표팀에 합류할 경우 한국 아이스하키는 마침내 링크의 지배자를 확보하게 된다.,https://sports.news.naver.com/news.nhn?oid=445&aid=0000000082,2013.12.09"
"아이스하키 인터뷰 스틱에 불났다상무 조민호,하고 싶은 플레이를 부담없이 할 수 있게 된 것이 요즘 하키가 잘 되는 이유 같아요 . 자신감 회복이 답이었다. 대명 상무 공격의 선봉 조민호의 아이스하키가 활짝 피어나고 있다. 경기고 시절부터 스피드와 개인기가 뛰어난 선수로 평가받은 조민호지만 지금처럼 빛이 나지는 않았다. 고려대 시절에도 아시아리그에서 당장 통할 것 이라는 평가를 받았음에도 우승컵과는 거리가 멀었다. 하지만 지금은 다르다. 그가 이끄는 상무는 첫 출전한 제68회 종합아시스하키선수권대회에서 우승을 차지했고 아시아리그에서도 예상을 깨고 당당히 3위를 달리고 있다. 팀 성적까지 책임지는 에이스로 거듭나고 있는 조민호의 말에서는 자신감이 넘쳤다. 그에게 붙여진 별명은 수도 없다. 하키 신동 코로스비 코리안 크로스비의 준말 스틱에 불났다 스틱웍이 빨라 붙여짐 등등. 지난해 상무에 입대한 조민호는 2013 2014 아시아리그 아이스하키에서 포인트 랭킹 4위를 달리고 있다. 한때 2위까지 치솟았으나 최근 상무의 경기가 뜸해지며 두계단 내려선 것이다. 종합선수권대회를 마치고 난 조민호를 만났다. 1. 한라에서 뛸 때보다 한결 더 잘하는 것 같은데 특별한 이유라도 있나 한라시절에는 성적에 대한 부담때문에 안정적인 플레이를 할 수 밖에 없었다. 위축된 플레이를 하다보니 실력을 제대로 발휘하지 못했는데 상무에서는 다치지 말고 열심히 하라고만 해 주셔서 오히려 잘 되는 것 같다. 2. 시즌 초반 부상으로 게임을 뛰지 못한 기억이 있는데. 허리부상이었다. 옆구리를 받쳐서 뛰지 못했지만 이제 다 나았다. 3. 앞으로의 계획은 무엇인가 하키를 오래 하는 거다. 친한 사람들은 모두 마흔살까지 뛰어보라고 한다. 그러기 위해서는 몸관리 잘하고 안다쳐야 한다. 평창올림픽에도 뛰고 싶다. 4. 지난해 핀란드에 갔지만 큰 소득은 없었는데 핀란드에 가서 우리가 우물안 개구리였다는 것을 느꼈다. 그리고 아시아 선수에 대한 인식이 전혀 없었기에 바꿔보고 싶었다. 핀란드에 2달 있었지만 뛰어볼 기회도 없었다. 아마도 우리를 쓸 마음이 없었던 것 같았다. 상무에 있는 동안 갈고 닦아 제대 후 큰 리그에 도전하고 싶다. 5. 하키를 시작하게 된 동기는 은퇴한 김한성 선배가 이종사촌형이다. 한성이형이 초등학교 때 운동하는 걸 보고 이런 스포츠가 있구나 했다. 어려서부터 운동을 좋아했고 특히 축구를 잘했다. 육상선수를 하다가 초등학교 4학년 때부터 하키를 했다. 그 때 나보다 어린 선수들이 잘하는 것을 보고 짜증나 빨리 잘하고 싶어서 열심히 했다. 6. 좋아하는 선수가 있다면 한국에서는 한성이형 해외에서는 시드니 크로스비다. 7. 특기는 뭐라고 생각하나 골 넣는 것을 좋아하지만 게임을 풀어주는게 더 흥미있다. 찬스 났을 때 골 넣는 기회를 만들어 주는 것이 특기다. 예전에는 내가 결정해야겠다는 생각이 강했다. 지금은 무리할 필요없이 라인 메이트를 이용하면 된다는 것을 깨달았다. 정신적으로는 알고 있었지만 그게 잘 안됐는데 상무에 와서 확실히 배웠다. 8. 결혼은 언제쯤 여자친구는 빨리 하고 싶다. 단 아이스하키를 하는데 지장이 없었으면 좋겠다. 친한 선후배는 많은데 결혼을 전제로 만나는 여자친구는 아직 없다. 9. 하키선수들 중에 조민호 라인 이라는 것이 있다고 들었다. 친하게 지내는 선후배는 누가 있나. 김근호 김원중 이승엽 이용준 등 선배와 이돈구 오현호 김범진 문국환 김우영 등 많은 선후배와 잘 지낸다. 10. 호흡이 잘 맞는 선수가 있다면 김원중 신상우 김기성 이돈구 오현호 등이다. 오래 호흡을 맞추다 보니 이제는 퍽을 잡았을 때 어디에 있을 것이라는 걸 알 수 있다.,https://sports.news.naver.com/news.nhn?oid=445&aid=0000000083,2013.12.10"
"아이스하키고교생 4명 국가대표 후보선수U20에 선발,국가대표 후보에 함께 선발된 연대 김건우 좌 와 고대 황두현. 고교 유망주 이연승 경복고 김권영 선덕고 이상 골리 서영준 보성고 정종현 경성고 이상 수비수 등 4명이 국가대표 후보선수 U 20 에 뽑혔다. 대한아이스하키협회는 11일 이승혁 고려대 등 국가대표 후보선수 23명의 명단을 발표했다. 김희우 고려대감독과 유상우 연세대 코치가 각각 코칭스태프에 선발됐으며 협회 전임지도자 오솔길감독이 합류한다. 이번에 발표한 24명의 명단을 분류하면 대학생 20명 고교 3년생 4명이 포함됐다. 포지션별로는 골리 3명 수비수 9명 공격수 12명이다.,https://sports.news.naver.com/news.nhn?oid=445&aid=0000000084,2013.12.11"
