"아이스하키 카자흐 한국전 최종 명단 발표…정예멤버 제외,사진 국제아이스하키연맹 www.iihf.com 카자흐스탄이 지난달 30일 한국과 친선경기에 나설 최종 엔트리 23인을 발표했다. 다음달 동계 유니버시아드 대회서 가상 일본전 을 준비하는 카자흐스탄은 이번 한국전에서 1군 정예멤버들을 대거 제외한 것으로 알려졌다. 사실상 대표팀은 85년생 이하 상비군 멤버로 구성한 것으로 알려졌다. 지난 4월 세계선수권 맞대결 당시 멤버로는 공격수 2명 로마노프 사벤코프 만이 포함됐다. 참고설명 노마드 아스타나 Nomad Astana 는 바르스 아스타나 2군팀으로 카자흐스탄 자국리그에서 활약중이다 카자흐 대표팀은 올 시즌 자국 빅클럽 바르스 아스타나 출신 공격수 KHL리거 3인방 라흐마노프 로마노프 안트시페로프를 선발한 것이 눈에 띈다. 또한 전통의 명가 카직 토르페도 사리 아르카에서 뛰는 VHL 러시아 2부리그 출신 7인이 포함됐다. 그 외에는 카자흐스탄 자국리그 출신들로 채워졌다. 차세대 유망주가 총집결된 카자흐 대표팀은 공격 선수자원이 탄탄하다. 공격수 중 카자흐스탄 성인대표 출신만 7명 KHL 출신은 무려 8명에 달한다. 특히 기대주 미하일 라흐마노프 21 바르스 아스타나 의 출전 여부에 관심을 모으고 있다. 현재 그는 대표팀 23인 중 유일한 붙박이 KHL리거로 활약 중이다. 라흐마노프는 올 시즌 KHL 23경기에 출전해 5골 3도움을 기록하며 준수한 성적을 거두고 있다. 92년생 막내인 그는 지난 2월 소치 올림픽 최종예선 대표로 선발되기도 했다. 지난 2011년 카자흐 알마티 아스타나 아시안게임에서 마주친 선수들도 눈에 띈다. 예브게니 류마레프 FW 와 170cm 스몰 포워드 맥심 쿠다코프 FW 는 당시 최정예 멤버로 선발되어 금메달을 따는데 일조했다. 특히 테크니션 류마레프는 2008년 20세 이하 세계선수권대회에서 콜린 윌슨 내쉬빌 NHL 과 함께 6골을 기록하며 득점왕에 오르며 화제를 모았다. 다만 디펜스와 골리 포지션은 성인 대표급 선수는 조지 페트로프 카직 토르페도 단 한명에 불과해 정예팀과 비교해 무게감이 떨어질 것으로 보인다. 그래도 카자흐리그 수준이 생각보다 높은 것으로 평가받은만큼 자국 리그의 수준을 살펴볼 수 있는 좋은 기회가 될 것이다. 더욱 젊어진 차세대 카자흐 대표팀은 6일과 7일 고양 어울림누리 얼음마루에서 한국 국가대표팀과 친선경기 2연전을 치른다.,https://sports.news.naver.com/news.nhn?oid=445&aid=0000000024,2013.11.05"
"아이스하키 카자흐스탄 한국선발에 5대0 대승,카자흐스탄 미하일 라흐마노프 21 바르스 아스타나 의 슛 아시아리그 득점왕 마이클 스위프트의 개인기도 브라이언 영의 수비도 카자흐스탄 하키 앞에서는 무용지물이었다. 카자흐스탄 선발팀은 6일 고양어울림누리에서 벌어진 2013 대한민국 아이스하키 대표팀 친선경기에서 마이클 스위프트와 브라이언 영 이상 하이원 이 가세한 한국선발팀을 5대0으로 완파했다. 한국대표팀이 올림픽에 나가려면 왜 체격이 커야 하는지 왜 빨라야 하는지를 알려준 승부였다. 아시아 최강팀 카자흐스탄은 개인기와 스피드 힘의 우세를 과시하며 한수위의 기량을 선보였다. 한국은 1피리어드에서는 스피드를 앞세워 카자흐스탄에 대등하게 맞섰고 0 0으로 팽팽하게 승부를 가져갔다. 그러나 탐색전을 마친 카자흐스탄 선수들은 2피리어드부터 본격적으로 개인기로 한국 수비진을 공략했다. 특히 러시아리그 KHL 에서 뛰고있는 카자흐스탄의 기대주 미하일 라흐마노프 21 바르스 아스타나 의 개인기가 돋보였다. 박성제 골리가 콘스탄틴 로마노프의 슛을 막고 있다. 라흐마노프는 1피리어드 4분쯤 스틱웍을 앞세운 돌파로 콘스탄틴 로마노프에게 정확한 패스를 찔러 넣었고 로마노프는 가볍게 선취골을 뽑았다. 라흐마노프는 15분쯤에는 한국 수비진영 왼쪽을 단독 드리블로 돌파한 뒤 골대 뒤를 돌아 또한 번 정확한 슛을 날렸다. 한국 골리 박성제의 방어에 흘러나온 퍽을 알렉세이 안티페로프가 때려 넣어 스코어는 2 0으로 벌어졌다. 이미 승기를 확인한 카자흐스탄은 18분쯤에는 콘스탄틴 사베노프가 또 한골을 보태 3 0으로 점수차를 벌렸다. 카자흐스탄의 공세는 3피리어드에서도 계속됐다. 15분쯤에는 트랴스노프 에체스라프가 종료 1분전에는 맥심 쿠다예프가 현란한 개인기에 의한 다섯번째 골을 뽑아내며 6백여 관중의 박수를 받았다. 하이원 선수를 주축으로 상무 3명 박종수 광운대 등 대학선수 7명이 주축을 이룬 한국선발은 2m에 가까운 조지 페트로프를 앞세운 카자흐스탄의 철벽 방어에 상대의 골문을 열기에는 역부족이었다. 카자흐 대표팀은 KHL에서 뛰고 있는 선수 3명과 자국리그 출신들이 뽑힌 차세대 유망주로 이루어진 선발팀이다. 한국은 6일 일본에서 귀국한 안양 한라 선수들과 상무 선수를 주축으로 7일 또 한차례 경기를 펼친다.,https://sports.news.naver.com/news.nhn?oid=445&aid=0000000026,2013.11.06"
"아이스하키 신상훈과 안진휘 동반 상승세,핀란드에서 한국 아이스하키의 꿈나무가 쑥쑥 자라나고 있다. 유망주 신상훈 20 연세대 과 안진휘 22 고려대 가 주인공이다. 핀란드 메스티스리그 키에코 완타에서 활약중인 신상훈과 안진휘는 7일 한국시간 바사아레나에서 열린 스포르트와의 원정경기에 동반 출전해 나란히 한골씩을 터뜨렸다. 그러나 팀은 3대4로 역전패 해 두선수의 골은 빛이 조금 바랬다. 핀란드에서 한국 선수가 나란히 골을 기록한 것은 이번이 처음이다. 신상훈은 시즌 4호 안진휘는 시즌 첫번째 골. 이 두선수는 대한아이스하키협회가 2018 평창올림픽을 위해 지난해부터 시작한 핀란드 프로젝트의 꿈나무들이다. 신상훈은 고려대와의 정기전을 치른 뒤 지난달 1일 키에코 완타에 합류했다. 초반에는 3 4조를 오르내리면서 적응을 마쳤고 최근 2라인으로 승격한 뒤 맹활약 중이다. 안진휘는 주로 4라인에서 뛰었으나 이날 선수 부상으로 생긴 절호의 기회에서 3라인으로 승격된 뒤 첫 골을 터뜨렸다. 신상훈 왼쪽 과 안진휘. 사진 제공 대한아이스하키협회 레프트윙인 신상훈은 팀이 1 0으로 앞선 1피리어드 5분 20초에 공격지역 우측에서 반대쪽으로 패스를 내주자 송곳 같은 슛을 날려 골망을 갈랐다. 안진휘는 지난 7월 키에코 완타로 이적한 뒤 18경기 만에 첫 골을 뽑아냈다. 안진휘는 경기 도중 3라인으로 전진 배치됐고 2 4로 역전 당한 3피리어드 10분 34초에 만회골을 넣었다. 협회 양승준 전무이사는 누구든 좋은 성적을 내면 1부리그 승격을 위해 에이전트를 주선해 주는 등의 지원을 할 예정이다. 이 프로젝트가 서서히 자리를 잡아가는 것 같다 고 했다. 한편 이들과 함께 떠난 안정현과 김지민 이상 안양 한라 은 현재 3부리그에서 뛰며 2부리그 진출을 노리고 있다.,https://sports.news.naver.com/news.nhn?oid=445&aid=0000000027,2013.11.07"
"아이스하키 인터뷰 일본 프로팀 소속 신형윤 근황 “배운다는 자세로 열심히 하고 있어요”,신형윤. 아시아리그에서 활약중인 그는 일본에서 뛰는 유일한 한국 선수다. 일본진출 1호인 신현대 전 안양 한라 김혁 송동환 이상 강원 하이원 에 이은 네번째. 페이스오프 3분 전을 알리는 버저가 울린다. 링크 장에 도열하는 일본 선수 사이에 낯익은 얼굴과 이름이 보인다. 일본 제지 크레인즈 No.35 신형윤. 고려대학교 주장으로 활약한 그는 2012년 12월 27일 졸업을 앞두고 일본행 비행기에 몸을 실었다. 빠른 스피드와 현란한 드리블로 대학 아이스하키 최고 공격수로 군림하던 그가 프로팀 막내로 다시 태어나는 순간이었다. 그로부터 1년 여쯤 지난 현재 일본 프로팀 소속 유일한 한국 선수인 신형윤의 근황을 물어 봤다. 1. 작년 시즌 중반쯤 팀에 합류해 두 번째 시즌을 뛰고 있는데 소감이 어떤가 대학 대회를 마치고 충분히 준비하지 못하고 합류했다. 처음에는 이것저것 생각할 겨를도 없이 적응하기 바빴는데 이번 시즌은 조금 적응했다. 그런데 아이스하키는 하면 할수록 어려운 스포츠라는 생각이 든다. 웃음 2. 대학 졸업 후 크레인즈로 직행했다. 그 이야기가 궁금한데 모교인 고려대가 매년 와세다대와 교류전을 가진다. 1학년이던 2009년에 고대가 원정으로 와세다대와 교류전을 가졌는데 크레인즈 관계자가 경기를 지켜봤다고 들었다. 그때부터 관심을 조금 가지고 있었는데 2010년 말 일본에서 있었던 한일 대학 아이스하키대회에서 한 번 더 지켜보다가 4학년 때 테스트를 보자고 연락이 왔었다. 그래서 정기전을 앞두고 일본 쿠시로에 가서 테스트를 본 뒤 계약서에 도장을 찍었다. 3. 동료들과의 의사소통은 어떤지 어떤 선수와 친하게 지내는가 모든 의사소통은 일본어로 하고 있다. 팀 동료들이 일본어를 가르쳐줘서 소통에는 문제가 없다. 다들 친근하게 지내지만 아무래도 나이가 비슷하고 같은 해에 데뷔한 선수들과 자주 어울려 다닌다. 4. 경기가 없을 땐 보통 무엇을 하며 지내는지 동료들과 플레이스테이션 게임을 하거나 시내에 가서 밥을 먹곤 한다. 함께 개인 운동도 하고 링크장 사우나에서 수다를 떨며 피로를 풀기도 한다. 뭐 별다른 건 없다. 5. 개막 직전에 부상을 당했다는 소식에 팬이 걱정을 많이 했는데 프리시즌 때 상대 선수에게 체킹을 당해 갈비뼈를 다쳤다. 다행히 3주 만에 회복됐지만 몸 상태를 염려한 감독님의 배려로 무리하게 출전하지 않다가 한국 원정을 시작으로 본격적으로 경기에 나서고 있다. 6. 재밌는 건 기록한 포인트가 모두 시게노 슌스케와 타카기 켄타와 호흡을 이룬 조에서 나왔다. 특별한 이유가 있는가 특별한 이유는 없다. 듣고 보니 나도 신기하다는 생각이 든다. 사실 경기를 할 때 그런 건 신경 쓸 부분이 아니다. 단지 같이 데뷔한 동료들이고 신인이라 조금 더 움직이는 플레이를 하다 보니 좋은 결과가 있는 것 같다. 7. 시즌 중반부로 접어들었는데 개인적인 목표가 있다면 초반 가벼운 부상으로 액땜했으니 더는 부상 없이 시즌을 마치는 것이다. 그리고 팀이 플레이오프에 진출해서 작년보다 좋은 성적을 거뒀으면 한다. 8. 마지막으로 하고 싶은 말 먼저 하키뉴스 코리아 의 탄생을 축하한다. 소식을 전하거나 들을 곳이 없어 답답했는데 좋은 일이라고 생각한다. 그리고 멀리 한국에서 응원해주시는 가족과 지인들에게 늘 감사하고 앞으로 좋은 모습 많이 보여드려서 한국 아이스하키 선수로서 자부심을 가지고 경기에 임하도록 하겠다. 뷰 직전 짧은 휴가를 받아 한국에 온 신형윤은 선생님들과 응원하는 지인들에게 인사드리는 것을 잊지 않았다고 말했다. 타국에서 홀로 생활하지만 한국 선수를 대표하여 일본팀에 있다는 마음으로 늘 훈련을 게을리하지 않는 신형윤. 남은 경기가 아직 많은 만큼 매 경기 그의 활약을 기대해 본다.,https://sports.news.naver.com/news.nhn?oid=445&aid=0000000028,2013.11.07"
"아이스하키 박우상 종료 직전 동점골 한국 카자흐스탄과 무승부,한국 아이스하키가 카자흐스탄과 맞설 정도로 성장했다. 한국 선발팀은 7일 고양 어울림누리에서 벌어진 카자흐스탄 선발팀과의 평가전에서 슛아웃 접전 끝에 2대2로 비겼다 이날 경기는 친선경기와 별도로 벌어진 승부샷에서 카자흐스탄에 2대3으로 졌다. 3피리어드 종료 9초전 한국 대표팀은 박우상의 동점골로 드라마틱한 동점을 만들어내며 팬들의 환호를 이끌어냈다. 하지만 승자는 슛아웃 접전 끝에 승리한 카자흐스탄의 몫이었다. 박우상이 대표팀 에이스임을 확인한 경기였다. 1대2로 한점차로 뒤진 종료 1분전 박우상은 골리를 빼고 공격수를 투입한 파상 공세에서 혼전 상황을 틈타 카자흐스탄 넷망을 흔들었다. 1차전에 이어서 출전한 마이클 스위프트도 국가대표팀 유니폼을 입은 이후 첫 골을 신고했다. 브라이언 영도 팀의 주축 수비수로 출격해 파상공세로 전력을 다한 카자흐스탄 수비진을 견고히 잘 막아냈다. 선수단 전원이 아시아리그 출신으로 탈바꿈한 한국 대표팀은 사실상 정예 멤버로 총출동했다. 안양 한라 상무 선수들이 대거 합류한 한국 대표팀은 1차전 멤버 5명을 제외한 모든 선수들을 바꿨다. 한편 귀화선수 출신 라던스키는 부상으로 제외되어 100% 전력을 구축하지 못했다. 1피리어드 8분경부터 한국 대표팀은 링크장을 넓게 사용하면서 세계선수권과 아시아리그에서 수차례 호흡을 맞춘 패턴 플레이를 보여주기 시작했다.1피리어드 9분경 이용준 FW 대명 상무 의 슈팅이 윗 천장을 맞고 나오면서 선취골 찬스를 놓쳤다. 이후 한국 벤치에서는 항의를 했지만 주심은 노골을 선언했다. 선취골 기회를 놓친 한국 대표팀은 1피리어드 15분경 주축 공격수 미하일 라흐마노프 FW 바르스 아스타나 에게 선취골을 헌납했다. 카자흐스탄 1라인 주축인 알렉세이 안시페로프 FW 바르스 아스타나 와의 콤비 플레이에 한국 대표팀은 순간 주춤했다. 여기서 마이클 스위프트 FW 하이원 의 한 방에 경기 흐름이 바꾸는데 성공했다. 초청 선수로 합류한 마이클 스위프트가 종료 35초전 5대3 파워플레이 기회에서 45도 지점에서 호쾌한 슬랩샷으로 동점골을 성공시켰다. 1대1 동점을 만든 한국 대표팀은 이후 침울했던 분위기를 바꿔나갔다. 2피리어드에서 1대1 접전 상황을 의식한 듯 카자흐스탄은 두 번째 골을 넣기 위해 총력을 다하며 슈팅 31회를 때려냈다. 그렇지만 한국 대표팀은 뛰어난 수비커버 능력으로 1대1 동점 상황을 그대로 유지했다. 세계선수권과 아시아리그에서 보여준 뛰어난 응집력이 보여줬다. 3피리어드부터 4조에서 3조 위주로 돌린 한국 대표팀은 카자흐스탄을 상대로 몰아치기 시작했다. 경기 시작 직후 31초만에 스위프트 박우상 이용준 라인을 중심으로 몰아치기 시작했다. 스위프트는 힘이 좋은 박우상을 옆에 두고 브라이언 영을 뒤에 두면서 틈이 있을 때마다 날카로운 슈팅을 때려냈다. 세계선수권 당시의 집중력으로 완전히 돌아간 한국 대표팀은 쉽게 골문을 허락하지 않았다. 카자흐스탄도 1차전과 달리 예리한 공격이 통하지 않으며 세밀함이 떨어졌다. 되려 종료 5분을 남기고 조민호의 단독 돌파로 득점 찬스를 만들었지만 얀코프 골리의 선방에 막혔다. 막판 수비 집중력이 흐트러진 한국 대표팀은 막판 1분 20초전 쿠디야코프에 불의의 일격을 맞으며 실점했다. 1 2가 된 한국 대표팀은 패배의 그림자가 드리워졌다. 하지만 한국 대표팀은 이에 흔들리지 않고 남은 시간동안 총력을 다하기 시작했다. 종료 9초전 박우상의 극적인 득점으로 또 다시 동점을 만들어냈다. 한국 대표팀은 골리를 빼고 6명의 플레이어를 내세워 공격에 임했고 3 4명의 선수들이 골 크리스 존을 싸매며 파상적인 공격을 한 끝에 득점을 성공시키며 2 2가 됐다. 이후 경기는 무승부로 마무리됐다. 이후 경기 결과와 상관없이 별도의 승부샷을 가졌고 2 3으로 패했다. 한국 대표팀에서는 박우상 이돈구가 득점을 성공시켰다.,https://sports.news.naver.com/news.nhn?oid=445&aid=0000000029,2013.11.07"
"아이스하키 고려대 공격수 위주로 뽑았다.,보성고등학교 서영준 고려대가 공격수 위주로 신입생을 대폭 보강했다. 고려대가 9일 공식 발표한 2014년 아이스하키 특기생 합격자 명단에 의하면 올시즌 고교리그 포인트 랭킹 1위인 김민철 중동고 과 2위 서영준 보성고 등 총 8명이 선발됐다. 경기고등학교 서경준 합격자 명단에는 김민철 외에 신동철 경복고 장용원 선덕고 윤준 보성고 김도형 광성고 이 수비수로는 서영준 외에 서경준 경기고 그리고 골리 이연승이 각각 뽑혔다. 학교별로는 보성고와 경복고가 2명씩이고 각 고교에서 고르게 선발된 것이 특징이다. 김민철은 올해 고교리그 1 2 3차 리그 21게임에서 36포인트 29골 7어시스트 를 기록해 이 부문 1위 서영준은 34포인트 16골 18어시스트 로 2위에 랭크됐다. 또 윤준도 5위 29포인트 에 오르는 등 고대는 공격 랭킹 5위 이내의 선수를 세 명이나 뽑았다. 연세대는 지난달 수비수 위주의 스카우트를 발표해 양교가 확연하게 차이나는 선수 선발을 했다. 김희우 고려대 감독은 4년생인 이현승 박진규 안진휘 등 팀의 주축 공격수들이 모두 졸업하게 되면 공격력 약화가 예상된다. 그래서 5명의 포워드와 공격형 수비수 2명을 뽑았다 고 했다. 한편 이재현 연세대 총감독은 올해에는 양교가 스카우트에서 5대5로 균형을 이룬 것 같다 고 평가했다. 고려대가 5개 대학 중 가장 마지막으로 8명의 선수를 확정함에 따라 올해 고교생 중 36명의 아이스하키선수가 대학에 진학하게 됐다.,https://sports.news.naver.com/news.nhn?oid=445&aid=0000000030,2013.11.09"
"아이스하키 박우상에 대한 소회,박우상의 시대 가 활짝 열렸다. 지난 7일 열린 한국 카자흐스탄 친선경기는 박우상에 의해 시작 박우상에 의해 끝난 경기였다. 그는 1라인 센터를 맡아 1피리어드부터 훨훨 날며 자신의 존재감을 유감없이 발휘했다. 카자흐스탄 친선전 골대앞에서 혼전 중 골리패드와 골대 사이로 슛을 밀어넣고있다. 예상보다 늦게 그의 시대가 왔다는 안타까움도 있지만 누구보다 반가운 마음이 앞선다. 박우상이 경성고등학교 3학년이던 10년 전 이맘 때로 기억된다. 당시 박우상은 김기성과 찰떡 호흡을 과시하며 경성고를 전관왕에 올려 놓은 유망주였다. 운이 좋게 필자는 연세대 진학이 확정됐던 박우상 부모와 저녁식사를 함께 할 기회가 있었다. 당시 연세대 윤성엽코치도 동석한 자리였다. 그 때 나는 아주 간곡하게 부탁 아닌 부탁을 했다. 연세대학에 만족하시지 말고 꼭 큰 무대에 도전하도록 해 주세요 라고. 아울러 윤성엽 코치에게도 정기전도 중요하지만 1년 후에는 꼭 해외로 내보내 달라 고 했다. 이후 박우상은 연세대학 4년을 대학 에이스로 자리매김했다. 이후에는 안양 한라에 입단 팀을 아시아리그 정상에 올려놓는 등 실력을 유감없이 발휘했다. 하지만 해외 진출 소식은 없었다. 정말 안타까웠다. 그러던 3년 전 박우상은 영국으로 갔다. 군에 입대하기 전 뭔가를 하고 싶었기 때문이었다. 박우상은 영국 EIHL 코벤트리 블레이즈에서 1년 간 뛰어 43게임에서 24포인트를 기록 성공적인 해외무대를 장식했다. 그 후 상무에 입대한 박우상은 아시아리그에서 다시 활약하게 되면서 심리적인 안정감을 되찾고 있는 것이다. 무엇보다도 선수 생활을 중단해야하는 압박감을 떨친 것이 그가 화려하게 제2의 전성기를 맞게 된 이유다. 박우상은 김한성 경기고 코치 이후 한국 하키가 배출한 가장 체격이 좋은 공격수다. 그 누구보다도 큰 무대에서 성공할 가능성이 큰 선수다. 한국 야구는 박찬호 이후 많은 선수를 메이저리그로 내보냈다. 골프도 박세리 이후 LPGA를 석권했다. 선구자가 나오기 전까지는 모든 것이 어렵게 느껴진다. 어느 길로 가야할 지 방법도 모르는 데다 기득권을 놓고 도전하기는 쉽지 않다. 그러나 도전이 성공하면 후배들에게 남겨주는 선물은 엄청나다. 만약 박찬호가 없었다면 박세리가 없었다면 야구와 골프의 오늘은 없었을 것이다. 이제 야구와 골프는 당당히 세계를 주름잡는 종목이 됐다. 아이스하키는 60 70년대 인기 종목의 영예를 계승하지 못했다. 유망주들이 현실에 안주했기 때문이다. 그 결과는 어떤가 박우상이 멈추지 않고 도전하는 모습을 보고 싶다. 그는 파이오니아의 자질이 충분한 체격에 소프트웨어까지 갖춘 보기드문 선수이기 때문이다. 이제부터라도 아이스하키의 도전은 계속돼야 한다.,https://sports.news.naver.com/news.nhn?oid=445&aid=0000000031,2013.11.09"
"아이스하키 대학 스카우트 분석탈락자가 생겼다.,경성고등학교 송형철 아이스하키도 이제는 대학에 진학하지 못하는 선수가 배출되는 종목이 됐다. 9일 고려대학교가 2014년 체육특기 신입생 합격자 발표를 함으로써 5개대학 신입생의 윤곽이 드러났다. 본사가 확인한 자료에 따르면 가장 먼저 합격자를 발표한 연세대학을 비롯해 경희대 한양대 광운대 고려대가 각각 뽑은 아이스하키 특기생은 모두 36명이다. 따라서 내년 2월 고교를 졸업하는 총 47명 중에서 대학 진학을 하지 못하는 선수의 수는 10명 안팎이 될 전망이다. 그러나 탈락자 중에서는 일반전형으로도 진학이 가능하기 때문에 그 수는 더 줄어들 수도 있다. 스카우트 결과를 보면 대학 최강의 전력을 구축하고 있는 연세대학은 정종현 송형철 이상 디펜스 경성고 허진영 오펜스 경복고 김권영 골리 선덕고 가 돋보인다. 최시영 등 4년생 주력수비수가 대거 졸업하는 연세대학은 수비수 보강에 주력했다. 표 참조 경복고등학교 신동철 이현승 등 4년생 공격 3인방이 졸업하는 고려대는 공격력 보완이 두드러진다. 고교 최고의 골잡이 김민철 중동고 과 스피드와 스케이팅이 좋은 신동철 경복고 장용원 선덕고 윤준 보성고 김도형 광성고 을 뽑았다. 또 수비수인 서영준 보성고 과 서경준 경기고 은 공격 가담능력이 뛰어나다. 고려대와 연세대가 예상대로 특급 선수를 선발한 가운데 한양대 경희대 광운대도 잠재력 있는 선수를 확보했다. 한양대학은 고교 골리 트리오 중의 한명인 중동고 골리 백승찬과 수비수 배병준 경복고 등을 합격자 명단에 올려 나름대로 짭짤한 수확을 했다. 그러나 배병준은 경희대와 광운대에도 복수 합격해 향후 행보가 주목된다. 경희대와 광운대도 1m86의 유망주 김현준 보성고 등을 중복 합격시켜 놓고 경쟁하게 됐다. 중복 합격자들이 어떤 대학을 선택할 것인가에 따라 한양대 경희대 광운대는 변화가 예상된다. 한 선수가 최대 5개 대학에 지원할 수 있도록 한 새로운 특기생 선발제도는 부분적으로 환영받을 만 하다. 그러나 중복합격한 선수와 예비합격자를 낸 선수간의 새로운 담합여부도 발생할 수 있다는 점에서 개선 여지가 있다. 아이스하키는 선수의 수가 적은데다 한 곳에서 대부분의 경기를 치르는 탓에 선수 학부형들끼리 아주 가깝게 지낸다. 따라서 정보가 쉽게 공유되는 종목의 특성이 있다.,https://sports.news.naver.com/news.nhn?oid=445&aid=0000000032,2013.11.10"
