"아이스하키 하이원 이기고 한라 졌다.,하이원은 웃었지만 한라는 울었다. 강원 하이원은 16일 일본 신요코하마 스케이트센터에서 열린 2013 2014 아시아리그 아이스하키 집결전에서 닛코 아이스벅스를 줄곧 앞서간 끝에 4대1로 제압했다. 하이원은 승점 27점을 기록 이날 일본제지 크레인스에 0대3으로 패한 4위 한라 승점 29점 를 바짝 추격하게 됐다. 하이원은 외국인 선수 외에 콘 요스케 등 4명의 일본 선수를 보유하고 있다. 아시아리그는 한 중 일 3개국 선수는 외국인 선수로 간주하지 않기 때문에 전력을 일본에서 보강했다. 그래서인지 하이원은 일본 원정경기에 강한 편이다. 이날 경기에서 뽑아낸 네 골이 모두 고향으로 돌아온 일본선수가 포인트에 가담했다. 하이원은 이날 파워플레이를 기반으로 차곡 차곡 득점을 했다. 1피리어드 11분께 얻은 파워플레이에서 콘 요스케 김동환으로 연결된 패스를 마이클 스위프트가 선취골로 연결했다. 2피리어드 8분 쯤에는 5 3 파워플레이를 얻었다. 파상공세에도 골은 터지지 않았으나 퇴장당했던 아이스벅스 두명의 선수가 링크로 돌아온 상태에서 유리하게 패스를 돌리다 추가골이 터졌다. 파워플레이가 끝나자 마자 거의 동시에 권태안 이시오카 빈으로 연결된 패스를 수비수 김혁이 대포알 같은 슬랩샷을 때렸고 퍽은 아이스벅스 왼쪽 골망을 갈랐다. 2 0으로 앞선 하이원은 3피리어드에서도 줄곧 여유 있는 플레이를 했다. 3피리어드 3분에는 이시카와가 사실상 승부를 결정짓는 추가골을 터뜨려 아이스벅스의 콧대를 납작하게 했다. 3 1로 앞서던 종료 직전에는 상대의 빈골대에 마이클 스위프트가 추가골을 뽑아내 완승했다. 하이원의 골리 이노우에는 경기 초반 여러차례 실점 위기를 맞았으나 25개의 슛을 막아내 팀 승리에 일조했다. 이노우에 70 가 닛코의 슛을 막아내고 있다. 앞서 열린 경기에서는 한라가 크레인스 골리 이시카와의 선방에 막혀 0대3으로 완패했다. 한라는 슈팅 수에서 33개로 똑같았지만 골운이 없었다.,https://sports.news.naver.com/news.nhn?oid=445&aid=0000000043,2013.11.16"
"아이스하키 하이원 크레인스에 분패. 페널티는 두 배.,강원 하이원이 일본제지 크레인스의 벽을 넘지 못했다. 신요코하마 집결전에 출전한 하이원은 17일 스케이트센터에서 벌어진 2013 2014 아시아리그 아이스하키에서 2피리어드까지 육탄전을 펼치며 선전했으나 막판 체력부진으로 크레인스에 3대7로 역전패했다. 크레인스는 승점 41점으로 이날 경기가 없었던 상무 39점 를 제치고 2위에 복귀했다. 비록 골 차이는 크게 났다. 하지만 중반까지는 손에 땀을 쥐게 하는 육탄 접전이었다. 심판의 휘슬에 이어지는 파워플레이. 그리고 골. 아이스하키의 진면목을 느끼게 해 준 한판 승부의 주인공은 크레인스였다. 하이원은 1피리어드부터 크레인스를 압박하더니 1분여 만에 데이비드 브린 김동환의 패스를 받은 이시카와 빈의 선제골이 터지면서 1 0으로 앞서나갔다. 반격에 나선 크레인스는 7분 쯤 하이원의 잇따른 파울로 얻어넨 5 3 파워플레이에서 마이크 라자가 동점골을 뽑아냈다. 라자는 15분 쯤 단짝인 아담 밀러의 패스를 다시 한 번 골로 연결 크레인스는 역전에 성공했다. 이후 양팀은 치열한 공방전을 했다. 2피리어드 10분 쯤 시게노의 골로 크레인스가 3 1로 앞섰지만 하이원은 상대의 파울에 편승했다. 12분 쯤 김동환이 16분에는 권태안이 잇따라 슬랩샷을 터뜨려 3 3으로 균형을 맞췄다. 크레인스는 이후 하이원 주력선수인 콘 요스케 35 송동환 33 이시카와 30 등이 체력에서 문제점을 보이자 승세를 잡았다. 17분 쯤 니시와키가 역시 파워플레이를 펼치다 한골을 뽑아 4 3으로 다시 앞서나간 크레인스는 3피리어드 들어서며 스케이팅을 따라다니지 못한 하이원을 무너뜨렸다. 9분쯤 페널티킬링에서 쿠보의 역습골로 분위기를 탄 크레인스는 25초 만에 밀러가 골리를 완벽하게 속이는 개인기로 다시 하이원의 그물망을 갈라 승리를 확정지었다. 하이원은 브라이언 영이 2피리어드에 체킹을 하다 10분 마이너페널티를 받는 등 체력소모가 많았고 3피리어드에서는 전혀 힘을 쓰지 못했다. 한편 이날 경기는 하이원이 파울 12개에 40분 페널티 크레인스가 6개에 12분의 페널티가 적용됐다. 특히 일본인 주심 야마우치는 고비때마다 하이원 공격의 흐름을 끊었다. 신요코하마 성백유 기자 하이원 벤치가 주심에게 항의하고 있다. 하이원 마이클 스위프트 23번 가 슛을 날리고 있다.,https://sports.news.naver.com/news.nhn?oid=445&aid=0000000044,2013.11.17"
"아시아리그 한라 적지에서 모처럼 시원하게 웃다.,한라 라던스키와 테스트위드가 아이스벅스 골문을 위협하고 있다. 전날의 완패가 약이 됐다. 안양 한라가 모처럼 적지에서 완승을 거둬 4위를 굳게 지켰다. 한라는 17일 신요코하마 스케이트센터에서 벌어진 2013 2014 아시아리그 아이스하키 닛코 아이스벅스와의 경기에서 어시스트 4개를 기록한 이영준의 활약을 앞세워 5대2로 이겼다. 승점 3점을 보탠 한라 32점 는 4위를 수성했다. 반면 하이원은 앞서 열린 경기에서 일본제지 크레인스에 3대7로 역전패 이날 차이나 샥스에 7대1로 이긴 토호구 프리블레이즈 승점 28점 에 5위를 내주며 6위 승점 27점 로 추락했다. 이번 교류전에서 크레인스는 2승을 챙겨 2위로 복귀했고 한라와 하이원은 각각 1승1패 아이스벅스는 2패를 더해 4강 플레이오프 진출에 적신호가 켜졌다. 한라 라던스키와 테스트위드를 1라인으로 묶은 효과가 서서히 나타나고 있다. 시즌 개막 이후 라던스키를 1조 테스트위드를 2조에 배치한 한라의 전략은 두 명의 듬직한 선수를 분산시켜 수비와 공격의 안정을 취하려는 뜻이었다. 수비에서는 그런대로 안정됐지만 공격에서의 효과는 썩 좋지 않았다. 이날 경기 전까지 한라는 54득점에 53실점으로 8개 팀 중 득실차에서 6위였던 것이 이를 말해준다. 심의식 감독은 지난 10일 하이원과의 경기부터 테스트위드를 1조로 올렸다. 그리고 5대2로 완승을 거둬 효과를 보는 듯 했지만 16일 크레인스전에서는 완봉패를 당해 희비가 엇갈렸다. 이날 한라는 1피리어드부터 아이스벅스를 몰아쳤다. 테스트위드 8번 가 득점한 뒤 동료들과 기뻐하고 있다. 1피리어드 6분쯤 테스트위드 이영준의 패스를 라던스키가 때려 넣어 기선을 제압한 한라는 2피리어드에 끝장을 봤다. 2피리어드 시작하자마자 제프 디멘 이영준의 똑같은 형태의 패스를 라던스키가 또 득점으로 연결하더니 6분에는 테스트위드가 이영준의 어시스트를 받아 넣었다. 3 0으로 앞선 한라는 18분에 문국환의 쐐기골이 터지면서 일찌감치 승리를 확인했다. 이영준은 종료 전 엠티넷 상황에서 어시스트를 추가해 최고의 날을 만끽했다. 신요코하마 성백유 기자 경기 도중 상대선수의 스틱에 얼굴을 다친 한라 주장 김우영이 주심에게 항의하고 있다.,https://sports.news.naver.com/news.nhn?oid=445&aid=0000000045,2013.11.17"
"아이스하키 연세대 우승 축배 웨이브즈는 준우승,연세대가 패권을 되찾았다. 웨이브즈는 첫 도전에 준우승의 기쁨을 만끽했다. 연세대는 18일 목동링크에서 막을 내린 2013 코리아컵 아이스하키에서 주전 전원의 고른 활약을 발판으로 경희대를 6대2로 제압 4전승으로 우승컵을 되찾았다. 이대회는 지난해 협회 사정으로 열리지 못해 연세대는 2010년 우승 이후 3년 만에 패권을 탈환했다. 이미 공동우승을 확보한 호화멤버의 연세대는 1피리어드 9분쯤 김희웅이 선취골을 뽑은데 이어 1분여 만에 강병걸의 추가골이 터지며 일찌감치 단독 우승을 예약했다. 이어 벌어진 경기에서는 웨이브즈가 한양대에 고전했지만 주장 함정우가 혼자 두 골을 터뜨린데 힘입어 3대1로 승리했다. 웨이브즈는 3승1패로 2연패에 도전했던 고려대 2승2패 를 제치고 2위를 차지했다. 웨이브즈는 1피리어드를 득점없이 끝냈다. 그러나 2피리어드 시작하자 마자 용현종이 단독 찬스에서 선취골을 뽑아냈고 16분에는 함정우가 추가골을 넣어 여유를 찾았다. 함정우는 종료 직전 쐐기골을 뽑아 냈다. 한양대는 18분 쯤 전예주가 추격골을 뽑아냈지만 승부를 되돌리기에는 역부족이었다.,https://sports.news.naver.com/news.nhn?oid=445&aid=0000000046,2013.11.18"
"아이스하키 남은 두자리. 4강 싸움 치열한 4파전으로...,오지 오사와 유토와 한라 박상진이 몸싸움을 하고 있다. 4강싸움은 이보다 더 치열하다. 4강티켓 두 자리의 주인공은 누구인가 아시아리그의 한국팀들이 17일 신요코하마 집결전을 끝으로 장기 휴식에 돌입했다. 12월 5일 상해에서 열리는 안양 한라와 차이나 드래건스와의 경기 전까지 약 20일에 가까운 공백이다. 한국과 일본 양국이 자국리그를 위해 만든 일명 내셔널 브레이크 로 한국에서는 종합선수권대회가 열린다. 지난 9월 7일 개막한 아시아리그는 팀마다 일정이 각각 다르지만 한라와 대명 상무가 이미 22게임을 치러 반환점을 돌아섰다. 강원 하이원이 15게임을 마쳐 8개팀 중 가장 적은 게임을 소화했다. 상무는 승점 39점을 획득해 3위를 달리고 있고 한라가 32점으로 4위를 간신히 지켰으나 한라는 최약체인 드래건스와의 경기를 하지 않았기 때문에 상무와 한라의 격차는 크지 않다. 또 양팀 맞대결 성적도 1승1패로 팽팽하다. 하이원은 드래건스전에서 승점 9점을 따냈지만 상무나 한라에 비해 무려 7게임을 덜 했기 때문에 5할승률을 가정한다면 상무와 한라에 비해 크게 뒤질 것이 없다. 반면에 집결전에서 한국팀에 2패를 떠안은 닛코 아이스벅스는 사실상 4강이 어렵게 됐다. 18게임을 치른 아이스벅스 승점 11점 는 남은 경기에서 6할 이상의 승률을 올려야 한다. 하지만 현재 팀 전력으로는 5할 승률도 어려워 보인다. 아시아리그는 지난해부터 팀당 42게임씩을 치르고 있다. 전문가들은 4강에 오르기 위한 안정적인 승점을 65 70점으로 예상하고 있다. 한라는 지난해 승점 73점으로 4강플레이오프에 턱걸이했다. 따라서 1위 오지 이글스 승점 44점 와 2위 크레인스 승점 41점 는 이변이 없는 한 플레이오프 진출이 확실시 된다. 따라서 남은 두자리를 놓고 상무 39점 한라 하이원 그리고 토호구 프리블레이즈가 치열하게 경쟁할 것이다. 5위인 프리블레이즈는 승점이 32점이나 상무와 한라에 비해 두 게임을 덜 치렀다. 특히 시즌 초반에는 부진하다가 중반 이후 치고 올라가는 팀 컬러를 유지해 강력한 다크호스로 주목해야 한다. 지난해에도 프리블레이즈는 6위로 중반을 넘어서더니 막판 상승세로 2위가 됐고 챔피언에까지 올랐다. 프리블레이즈는 오지 제지에서 뛰었던 용병 카보시를 영입한 뒤 최근 한라를 연파하는 상승세를 탔다. 한라와의 시즌 전적에서도 3승1패로 앞서기 시작했다. 다만 드래건스와의 게임이 2경기 밖에 남지 않은 점이다. 예년의 경우 4강 싸움은 일찍 결정이 났지만 올해는 그 어느때보다 치열한 점수싸움이 전개되고 있어서 어느 한팀도 마음을 놓기 어렵게 됐다.,https://sports.news.naver.com/news.nhn?oid=445&aid=0000000047,2013.11.19"
"아이스하키 4강 진출의 아킬레스건은 바로 이것.,강원 하이원은 체력 안양 한라는 공격력. 아시아리그 순위다툼은 국가별 경쟁보다는 한국 내 삼국지가 더 관심거리다. 중국 차이나 드래건스가 워낙 약체여서 한 일간의 대결구도인 탓이다. 그 중에서도 닛코 아이스벅스는 이미 탈락이 확정적이고 이미 3위로 치고 나간 대명 상무는 큰 이변이 없다면 4강 플레이오프 안착은 시간 문제다. 따라서 중위권 싸움에 가세한 한라와 하이원이 내셔널 브레이크 기간 중에 어떤 전력보강을 할 수 있을 것인지가 관심거리다. 안양한라 브락 라던스키와 마이크 테스트 위드 우선 4위 한라의 아킬레스건은 공격력 부진에 있다. 주전 공격수들이 대거 상무에 입대한 한라는 올 시즌 22경기에서 득점 59점 실점 55점으로 골득실에서 4점에 그치고 있다. 15전패를 기록 중인 드래건스와의 경기를 치르지 않은 점도 있지만 가장 많은 22게임을 치르고도 50점대의 득점에 그치고 있는 것은 치명적이다. 1위 오지가 53점 2위 크레인스가 39점 상무가 11점을 기록중인 것과 비교해 보면 상대적으로 열악하다. 한라는 최근 공격력 강화를 위해 2조에서 뛰던 외국인 선수 테스트위드를 1조로 올려 라던스키와 호흡을 맞추게 했다. 라인 조정 후 하이원과 닛코 아이스벅스 전에서 각각 5대2로 승리했다. 그러나 크레인스와의 경기에서는 0대3으로 완패했다. 용병의 결합 효과를 논하기에는 아직 이르지만 현재까지는 성공적이라고 볼 수 있다. 부상으로 쉬고 있는 김상욱이 언제 가세하느냐도 변수다. 강원 하이원 송동환 하이원의 문제는 아직 수면 아래에 있다. 하지만 하이원은 15게임 밖에 치르지 않았기 때문에 중반기 이후가 걱정이다. 12월 이후에 경기가 몰려 있는데다 콘 요스케 송동환 등 주력선수가 30대를 넘겨 체력적인 부담이 크다. 특히 하이원은 1 3조와 4조의 격차가 큰 것이 약점이다. 시즌 초반 일정이 여유가 있던 탓에 3라인으로 충분히 경기를 치를 수 있었고 부상선수도 거의 없었다. 이들 두 팀에게 변수는 있다. 대학 4학년 선수들의 수혈이다. 아시아리그는 12월까지 선수 보강이 허용된다. 과거 김상욱 조민호 김형준 등 대학의 우수자원들은 연말부터 팀에 가세해 매번 힘을 보탰다. 한라와 하이원은 대학 선수 선발을 두고 침묵 중이다. 정몽원 대한아이스하키협회장이 선거 공약으로 드래프트 제도 도입을 약속했기 때문이다. 그러나 대학팀들은 드래프트에 반대하고 있어서 스카우트를 시작도 못했다. 올해에는 이현승 박진규 이상 고려대 최시영 김철준 이상 연세대 등 다수의 4년생들이 프로행을 준비하고 있다. 20일 간의 휴식 기간에 열리는 종합선수권대회도 변수다. 부상을 입는 선수가 발생하거나 체력부담을 안게 되면 아시아리그 4강 티켓의 향방은 달라진다.,https://sports.news.naver.com/news.nhn?oid=445&aid=0000000048,2013.11.20"
"아이스하키 신상훈 안진휘 꿈이 무르익는다.,핀란드 프로하키 2부리그 메스티스 키에코 완타 신상훈 안진휘 패스 신상훈 골. 한국 아이스하키에 새로운 득점 공식이 열리고 있다. 핀란드 프로하키 2부리그 메스티스의 키에코 완타에서 활약하고 있는 신상훈 20 과 안진휘 22 콤비의 손발이 척척 맞아 떨어지고 있는 것이다. 신상훈은 21일 한국시간 트리오 아레나에서 열린 펠리탓과의 홈 경기에서 1 2로 뒤진 2피리어드 5분 44초에 안진휘의 패스를 받아 동점골을 터뜨렸다. 지난 17일 JYP 아카테미아전에 이은 2경기 연속 합작골을 터뜨린 것. 핀란드 프로하키 2부리그 메스티스 키에코 완타 안진휘 안진휘는 2피리어드 5분쯤 수비 지역에서 퍽을 가로채 상대 진영으로 돌진하던 신상훈에 퍽을 연결했고 단독 찬스를 잡은 신상훈이 이를 완벽하게 마무리했다. 4라인에서 라이트윙으로 경기에 나선 신상훈은 시즌 6호 골을 센터로 출전한 안진휘는 두 번째 어시스트를 기록했다. 두 선수는 연장전까지 치르는 동안 고작 8번 밖에 링크에 서지 못했다. 그러나 단 한번의 기회를 놓치지 않았다. 대한아이스하키협회와의 인터뷰에서 안진휘는 “상훈이와 서로 퍽을 잡았을 때 움직여 공간을 만들며 패스를 주고 받아 찬스를 노리는 방식으로 훈련을 많이 했고 실전에서도 잘 들어 맞고 있다. 오늘 경기에서도 호흡이 잘 맞았는데 출전 기회가 많이 주어지지 않았던 점이 아쉽다”고 했다. 메스티스리그는 아시아리그 보다 약간 수준이 높은 것으로 평가 받는다. 여기에서 좋은 활약을 펼치면 톱 리그 진입의 길이 열린다. 한편 키에코 완타는 연장까지 가는 접전 끝에 4 5로 패배 5연패를 기록했다. 정규리그 24경기를 치른 21일 현재 키에코 완타는 8승13패 승점 31 로 12팀 가운데 9위를 달리고 있다.,https://sports.news.naver.com/news.nhn?oid=445&aid=0000000049,2013.11.21"
"아시아리그 상무 또 악재 이유원 시즌 접는다.,대명상무 이유원 잘 나가던 대명 상무에 비상등이 켜졌다. 상무의 맏형이자 주장인 1라인 공격수 이유원 29 이 부상으로 시즌을 접게 됐다. 변선욱 상무감독은 22일 이유원이 무릎 십자인대 부상으로 26일 삼성의료원에서 수술을 받게 됐다. 수술 상황을 지켜봐야 하겠지만 6개월 이상 재활치료가 필요하다는 진단을 받았다 고 했다. 이유원은 지난번 일본 원정 때 일본제지 크레인스와의 경기에서 상대선수와 부딛혀 무릎을 다쳤다. 이유원은 현재 문경 상무부대에 머물며 수술 전 재활을 하고 있다. 변감독은 일본 선수들이 상무와의 경기를 할 때마다 보통 때보다 더 심하게 몸싸움을 걸어 온다. 일본 심판들은 이유원이 다쳤을 때도 페널티를 선언하지 않았다 고 했다. 연세대 4학년 때인 2006년 안양 한라에 합류한 이유원은 국내 선수들 중 가장 빠른 선수 중 한명이다. 그는 강원 하이원을 거쳐 지난해 상무에 입대했으며 지난 시즌까지 아시아리그에서 200경기를 넘게 뛴 베테랑 선수다. 엔트리 17명으로 아시아리그에 뛰어든 상무는 시즌 개막과 함께 서신일과 김기성이 부상으로 뛰지 못해 15명으로 시즌을 꾸려오면서도 투혼을 발휘해 3위를 달리고 있다. 서신일은 11월부터 경기에 출전하고 있고 김기성은 26일 개막하는 종합선수권대회 때부터 링크로 돌아올 전망이다.,https://sports.news.naver.com/news.nhn?oid=445&aid=0000000050,2013.11.22"
"아이스하키 4점을 뽑아라,오지 수문장 오기노 준지와 철벽 수비진 4점을 뽑으면 이긴다. 1위에 도전했던 일본제지 크레인스의 도전도 무산됐다. 2위 자격으로 단독선두 오지 이글스와 한판승부를 펼친 크레인스는 23일 도마코마이에서 벌어진 원정경기에서 3대4로 무릎을 꿇었다. 이글스는 이 승리로 승점 47점을 기록했고 크레인스는 41점으로 점수 차가 다시 벌어져 공동 선두에 오르는데 실패했다. 11월 초 2위까지 치솟았던 대명 상무에 이은 도전 실패다. 이글스는 올시즌 17경기에서 16승1패 1승부샷승을 기록하고 있다. 그나마 1패를 안긴 팀은 강원 하이원아 아직도 유일하다. 하이원은 지난 10월 1일 열린 홈경기에서 이글스를 4대2로 제압해 이글스를 잡은 팀으로 등록돼 있다. 대명 상무는 9월에 열린 안양 집결전 때 2대1로 앞서가다가 종료 1분여를 남기고 동점골을 내준 뒤 승부샷에서 패해 진한 아쉬움을 남겼다. 정규리그에서 지난해보다 더욱 아성을 굳히고 있는 이글스의 질주에는 우승에 대한 강한 집념이 드러난다. 이글스는 지난해 월등한 성적으로 정규리그 1위를 차지해 2년 연속 통합우승의 꿈에 부풀었으나 2위였던 토호구 프리블레이즈와의 챔피언결정전에서 완패했다. 이글스는 올시즌을 앞두고 확실한 우승을 위해 팀을 다시 개편했다. 팀의 간판으로 군림해 온 콘 요스케 하이원 과 외국인 선수 2명을 모두 내보냈다. 마크 카보시 현 프리블레이즈 크리스 해링턴이 그들이다. 더구나 아시아리그는 올해부터 한국과 일본에 차등 적용해 온 외국인 선수 쿼터를 팀당 3명으로 동일화했다. 2명 뿐이던 외국인 선수가 3명으로 늘어남에 따라 이글스는 에릭 람페 마이크 콤폰 토마스 캠프 등 3명의 외국인 선수가 뛰고 있다. 더구나 이글스는 귀화선수인 애런 캘러가 38세의 노장임에도 여전히 수비의 축으로 자리잡고 있다. 라던스키가 귀화한 안양 한라와 마찬가지로 4명의 용병이 뛰는 효과를 누리고 있는 것이다. 이글스의 강점은 강력한 수비에 있다. 이글스는 올시즌 경기당 평균 득점 4.6점을 올리면서도 실점은 1.4점을 기록 중이다. 하루나 마사히토와 오기노 준지가 지키는 골문도 완벽에 가까울 뿐만 아니라 카와시마 야마시타 하가 사사키 등이 버티고 있는 디펜스는 짠물 수비망 을 구축했다. 박병철 하이원 매니저는 이글스의 수비진은 일본 대표팀이 그대로 포진해 있다 고 했다. 이글스의 최다 실점만을 놓고 보면 하이원이 이겼던 경기에서 4점을 올린 것이 가장 많은 점수다. 이글스의 골문을 어떻게 여느냐. 이글스를 상대하는 팀들이 공통적으로 갖고 있는 승리의 방정식이다.,https://sports.news.naver.com/news.nhn?oid=445&aid=0000000051,2013.11.24"
"아이스하키 대학 4년생 자유계약으로 아시아리그 간다.,좌 고려대 이현승 우 연세대 최시영 대학 4학년생들이 원하는 팀을 골라 아시아리그에 진출하게 됐다. 대한아이스하키협회 회장 정몽원 는 그동안 추진해 왔던 대학졸업반 선수들의 드래프트 제도 도입을 포기하고 기존에 해 왔던 자유계약제를 그대로 유지하기로 결정했다. 양승준 협회 전무이사는 25일 5개 대학 모두가 드래프트제에 반대 의사를 밝힘에 따라 자유계약제를 지속하기로 했다 면서 빠른 시일 내에 공문을 발송할 예정 이라고 말했다. 협회는 그동안 대학선수의 실업팀 진출 시 자유계약제도를 택해왔다. 그러나 정몽원 회장이 지난 1월 대의원총회 때 선거 공약으로 드래프트제도 도입을 내세운 바 있다. 이같은 결정에 대해 김희우 고려대감독은 드래프트 제도를 도입하기 위해서는 계약금 대학지원금 등 선결돼야 할 사항이 많다. 그런데 이런 보완책 없이 실업팀에서 선수를 일방적으로 지명한다는 것은 선수들의 희생을 요구하는 것 이라며 잘 된 결정 이라고 반겼다. 안양 한라 정기훈 부장은 그동안 협회의 결정을 기다려왔다. 이제부터 본격적으로 우리가 원하는 선수 접촉을 시작하겠다 고 했다.,https://sports.news.naver.com/news.nhn?oid=445&aid=0000000052,2013.11.25"
